00:22:23.719267 IP comp3134-lamponubuntu2204-s-2vcpu-4gb-tor1-01.ssh > 162.243.188.66.41515: Flags [P.], seq 134000:134448, ack 1, win 501, options [nop,nop,TS val 1197184440 ecr 2072545265], length 448
00:22:23.737575 IP 162.243.188.66.41515 > comp3134-lamponubuntu2204-s-2vcpu-4gb-tor1-01.ssh: Flags [.], ack 134448, win 898, options [nop,nop,TS val 2072545370 ecr 1197184440], length 0
00:22:23.823316 IP comp3134-lamponubuntu2204-s-2vcpu-4gb-tor1-01.ssh > 162.243.188.66.41515: Flags [P.], seq 134448:134896, ack 1, win 501, options [nop,nop,TS val 1197184544 ecr 2072545370], length 448
00:22:23.844339 IP 162.243.188.66.41515 > comp3134-lamponubuntu2204-s-2vcpu-4gb-tor1-01.ssh: Flags [.], ack 134896, win 898, options [nop,nop,TS val 2072545476 ecr 1197184544], length 0
00:22:23.927302 IP comp3134-lamponubuntu2204-s-2vcpu-4gb-tor1-01.ssh > 162.243.188.66.41515: Flags [P.], seq 134896:135344, ack 1, win 501, options [nop,nop,TS val 1197184648 ecr 2072545476], length 448
00:22:23.946511 IP 162.243.188.66.41515 > comp3134-lamponubuntu2204-s-2vcpu-4gb-tor1-01.ssh: Flags [.], ack 135344, win 898, options [nop,nop,TS val 2072545579 ecr 1197184648], length 0
00:22:24.031327 IP comp3134-lamponubuntu2204-s-2vcpu-4gb-tor1-01.ssh > 162.243.188.66.41515: Flags [P.], seq 135344:135792, ack 1, win 501, options [nop,nop,TS val 1197184752 ecr 2072545579], length 448
00:22:24.049281 IP 162.243.188.66.41515 > comp3134-lamponubuntu2204-s-2vcpu-4gb-tor1-01.ssh: Flags [.], ack 135792, win 898, options [nop,nop,TS val 2072545681 ecr 1197184752], length 0
00:22:24.135448 IP comp3134-lamponubuntu2204-s-2vcpu-4gb-tor1-01.ssh > 162.243.188.66.41515: Flags [P.], seq 135792:136240, ack 1, win 501, options [nop,nop,TS val 1197184856 ecr 2072545681], length 448
00:22:24.161637 IP 162.243.188.66.41515 > comp3134-lamponubuntu2204-s-2vcpu-4gb-tor1-01.ssh: Flags [.], ack 136240, win 898, options [nop,nop,TS val 2072545794 ecr 1197184856], length 0
^C
553 packets captured
558 packets received by filter
0 packets dropped by kernel