root@comp3134-lamponubuntu2204-s-2vcpu-4gb-tor1-01:~# tcpdump -n -i eth0
tcpdump: verbose output suppressed, use -v[v]... for full protocol decode
listening on eth0, link-type EN10MB (Ethernet), snapshot length 262144 bytes
00:20:47.516020 IP 178.128.225.34.22 > 162.243.188.66.41515: Flags [P.], seq 2084240125:2084240189, ack 4122727195, win 501, options [nop,nop,TS val 1197088237 ecr 2072449143], length 64
00:20:47.516782 IP 178.128.225.34.22 > 162.243.188.66.41515: Flags [P.], seq 64:192, ack 1, win 501, options [nop,nop,TS val 1197088237 ecr 2072449143], length 128
00:20:47.516873 IP 178.128.225.34.22 > 162.243.188.66.41515: Flags [P.], seq 192:256, ack 1, win 501, options [nop,nop,TS val 1197088237 ecr 2072449143], length 64
00:20:47.516907 IP 178.128.225.34.22 > 162.243.188.66.41515: Flags [P.], seq 256:336, ack 1, win 501, options [nop,nop,TS val 1197088237 ecr 2072449143], length 80
00:20:47.516950 IP 178.128.225.34.22 > 162.243.188.66.41515: Flags [P.], seq 336:416, ack 1, win 501, options [nop,nop,TS val 1197088237 ecr 2072449143], length 80
00:20:47.517006 IP 178.128.225.34.22 > 162.243.188.66.41515: Flags [P.], seq 416:496, ack 1, win 501, options [nop,nop,TS val 1197088238 ecr 2072449143], length 80
00:20:47.517069 IP 178.128.225.34.22 > 162.243.188.66.41515: Flags [P.], seq 496:560, ack 1, win 501, options [nop,nop,TS val 1197088238 ecr 2072449143], length 64
00:20:47.530447 IP 162.243.188.66.41515 > 178.128.225.34.22: Flags [.], ack 64, win 898, options [nop,nop,TS val 2072449162 ecr 1197088237], length 0
00:20:47.531407 IP 162.243.188.66.41515 > 178.128.225.34.22: Flags [.], ack 192, win 898, options [nop,nop,TS val 2072449163 ecr 1197088237], length 0
00:20:47.531408 IP 162.243.188.66.41515 > 178.128.225.34.22: Flags [.], ack 256, win 898, options [nop,nop,TS val 2072449163 ecr 1197088237], length 0
00:20:47.531408 IP 162.243.188.66.41515 > 178.128.225.34.22: Flags [.], ack 336, win 898, options [nop,nop,TS val 2072449163 ecr 1197088237], length 0
00:20:47.531408 IP 162.243.188.66.41515 > 178.128.225.34.22: Flags [.], ack 416, win 898, options [nop,nop,TS val 2072449163 ecr 1197088237], length 0
00:20:47.531459 IP 162.243.188.66.41515 > 178.128.225.34.22: Flags [.], ack 496, win 898, options [nop,nop,TS val 2072449163 ecr 1197088238], length 0
00:20:47.531459 IP 162.243.188.66.41515 > 178.128.225.34.22: Flags [.], ack 560, win 898, options [nop,nop,TS val 2072449163 ecr 1197088238], length 0
00:20:47.615329 IP 178.128.225.34.22 > 162.243.188.66.41515: Flags [P.], seq 560:800, ack 1, win 501, options [nop,nop,TS val 1197088336 ecr 2072449163], length 240
00:20:47.615417 IP 178.128.225.34.22 > 162.243.188.66.41515: Flags [P.], seq 800:1088, ack 1, win 501, options [nop,nop,TS val 1197088336 ecr 2072449163], length 288
00:20:47.615465 IP 178.128.225.34.22 > 162.243.188.66.41515: Flags [P.], seq 1088:1152, ack 1, win 501, options [nop,nop,TS val 1197088336 ecr 2072449163], length 64
00:20:47.615522 IP 178.128.225.34.22 > 162.243.188.66.41515: Flags [P.], seq 1152:1376, ack 1, win 501, options [nop,nop,TS val 1197088336 ecr 2072449163], length 224
00:20:47.615567 IP 178.128.225.34.22 > 162.243.188.66.41515: Flags [P.], seq 1376:1440, ack 1, win 501, options [nop,nop,TS val 1197088336 ecr 2072449163], length 64
00:20:47.615594 IP 178.128.225.34.22 > 162.243.188.66.41515: Flags [P.], seq 1440:1664, ack 1, win 501, options [nop,nop,TS val 1197088336 ecr 2072449163], length 224
00:20:47.615639 IP 178.128.225.34.22 > 162.243.188.66.41515: Flags [P.], seq 1664:1728, ack 1, win 501, options [nop,nop,TS val 1197088336 ecr 2072449163], length 64
00:20:47.615666 IP 178.128.225.34.22 > 162.243.188.66.41515: Flags [P.], seq 1728:1952, ack 1, win 501, options [nop,nop,TS val 1197088336 ecr 2072449163], length 224
00:20:47.615710 IP 178.128.225.34.22 > 162.243.188.66.41515: Flags [P.], seq 1952:2016, ack 1, win 501, options [nop,nop,TS val 1197088336 ecr 2072449163], length 64
00:20:47.615735 IP 178.128.225.34.22 > 162.243.188.66.41515: Flags [P.], seq 2016:2240, ack 1, win 501, options [nop,nop,TS val 1197088336 ecr 2072449163], length 224
00:20:47.615781 IP 178.128.225.34.22 > 162.243.188.66.41515: Flags [P.], seq 2240:2304, ack 1, win 501, options [nop,nop,TS val 1197088336 ecr 2072449163], length 64
00:20:47.615801 IP 178.128.225.34.22 > 162.243.188.66.41515: Flags [P.], seq 2304:2528, ack 1, win 501, options [nop,nop,TS val 1197088336 ecr 2072449163], length 224
00:20:47.615852 IP 178.128.225.34.22 > 162.243.188.66.41515: Flags [P.], seq 2528:2592, ack 1, win 501, options [nop,nop,TS val 1197088336 ecr 2072449163], length 64
00:20:47.615867 IP 178.128.225.34.22 > 162.243.188.66.41515: Flags [P.], seq 2592:2800, ack 1, win 501, options [nop,nop,TS val 1197088336 ecr 2072449163], length 208
00:20:47.629751 IP 162.243.188.66.41515 > 178.128.225.34.22: Flags [.], ack 800, win 898, options [nop,nop,TS val 2072449262 ecr 1197088336], length 0
00:20:47.629814 IP 178.128.225.34.22 > 162.243.188.66.41515: Flags [P.], seq 2800:4496, ack 1, win 501, options [nop,nop,TS val 1197088350 ecr 2072449262], length 1696
00:20:47.629833 IP 162.243.188.66.41515 > 178.128.225.34.22: Flags [.], ack 1088, win 898, options [nop,nop,TS val 2072449262 ecr 1197088336], length 0
00:20:47.629833 IP 162.243.188.66.41515 > 178.128.225.34.22: Flags [.], ack 1152, win 898, options [nop,nop,TS val 2072449262 ecr 1197088336], length 0
00:20:47.629833 IP 162.243.188.66.41515 > 178.128.225.34.22: Flags [.], ack 1376, win 898, options [nop,nop,TS val 2072449262 ecr 1197088336], length 0
00:20:47.629833 IP 162.243.188.66.41515 > 178.128.225.34.22: Flags [.], ack 1440, win 898, options [nop,nop,TS val 2072449262 ecr 1197088336], length 0
00:20:47.629833 IP 162.243.188.66.41515 > 178.128.225.34.22: Flags [.], ack 1664, win 898, options [nop,nop,TS val 2072449262 ecr 1197088336], length 0
00:20:47.629919 IP 162.243.188.66.41515 > 178.128.225.34.22: Flags [.], ack 1728, win 898, options [nop,nop,TS val 2072449262 ecr 1197088336], length 0
00:20:47.629919 IP 162.243.188.66.41515 > 178.128.225.34.22: Flags [.], ack 1952, win 898, options [nop,nop,TS val 2072449262 ecr 1197088336], length 0
00:20:47.629919 IP 162.243.188.66.41515 > 178.128.225.34.22: Flags [.], ack 2016, win 898, options [nop,nop,TS val 2072449262 ecr 1197088336], length 0
00:20:47.641640 IP 162.243.188.66.41515 > 178.128.225.34.22: Flags [.], ack 2800, win 898, options [nop,nop,TS val 2072449274 ecr 1197088336], length 0
00:20:47.644486 IP 162.243.188.66.41515 > 178.128.225.34.22: Flags [.], ack 4496, win 898, options [nop,nop,TS val 2072449276 ecr 1197088350], length 0
00:20:47.719342 IP 178.128.225.34.22 > 162.243.188.66.41515: Flags [P.], seq 4496:4720, ack 1, win 501, options [nop,nop,TS val 1197088440 ecr 2072449276], length 224
00:20:47.719436 IP 178.128.225.34.22 > 162.243.188.66.41515: Flags [P.], seq 4720:5008, ack 1, win 501, options [nop,nop,TS val 1197088440 ecr 2072449276], length 288
00:20:47.719483 IP 178.128.225.34.22 > 162.243.188.66.41515: Flags [P.], seq 5008:5072, ack 1, win 501, options [nop,nop,TS val 1197088440 ecr 2072449276], length 64
00:20:47.719520 IP 178.128.225.34.22 > 162.243.188.66.41515: Flags [P.], seq 5072:5296, ack 1, win 501, options [nop,nop,TS val 1197088440 ecr 2072449276], length 224
00:20:47.719569 IP 178.128.225.34.22 > 162.243.188.66.41515: Flags [P.], seq 5296:5360, ack 1, win 501, options [nop,nop,TS val 1197088440 ecr 2072449276], length 64
00:20:47.719606 IP 178.128.225.34.22 > 162.243.188.66.41515: Flags [P.], seq 5360:5584, ack 1, win 501, options [nop,nop,TS val 1197088440 ecr 2072449276], length 224
00:20:47.719738 IP 178.128.225.34.22 > 162.243.188.66.41515: Flags [P.], seq 5584:6224, ack 1, win 501, options [nop,nop,TS val 1197088440 ecr 2072449276], length 640
00:20:47.719776 IP 178.128.225.34.22 > 162.243.188.66.41515: Flags [P.], seq 6224:6512, ack 1, win 501, options [nop,nop,TS val 1197088440 ecr 2072449276], length 288
00:20:47.719811 IP 178.128.225.34.22 > 162.243.188.66.41515: Flags [P.], seq 6512:6736, ack 1, win 501, options [nop,nop,TS val 1197088440 ecr 2072449276], length 224
00:20:47.719847 IP 178.128.225.34.22 > 162.243.188.66.41515: Flags [P.], seq 6736:6800, ack 1, win 501, options [nop,nop,TS val 1197088440 ecr 2072449276], length 64
00:20:47.719884 IP 178.128.225.34.22 > 162.243.188.66.41515: Flags [P.], seq 6800:7024, ack 1, win 501, options [nop,nop,TS val 1197088440 ecr 2072449276], length 224
00:20:47.719919 IP 178.128.225.34.22 > 162.243.188.66.41515: Flags [P.], seq 7024:7088, ack 1, win 501, options [nop,nop,TS val 1197088440 ecr 2072449276], length 64
00:20:47.719955 IP 178.128.225.34.22 > 162.243.188.66.41515: Flags [P.], seq 7088:7312, ack 1, win 501, options [nop,nop,TS val 1197088440 ecr 2072449276], length 224
00:20:47.719992 IP 178.128.225.34.22 > 162.243.188.66.41515: Flags [P.], seq 7312:7376, ack 1, win 501, options [nop,nop,TS val 1197088441 ecr 2072449276], length 64
00:20:47.720028 IP 178.128.225.34.22 > 162.243.188.66.41515: Flags [P.], seq 7376:7664, ack 1, win 501, options [nop,nop,TS val 1197088441 ecr 2072449276], length 288
00:20:47.720101 IP 178.128.225.34.22 > 162.243.188.66.41515: Flags [P.], seq 7664:7952, ack 1, win 501, options [nop,nop,TS val 1197088441 ecr 2072449276], length 288
00:20:47.720153 IP 178.128.225.34.22 > 162.243.188.66.41515: Flags [P.], seq 7952:8176, ack 1, win 501, options [nop,nop,TS val 1197088441 ecr 2072449276], length 224
00:20:47.720206 IP 178.128.225.34.22 > 162.243.188.66.41515: Flags [P.], seq 8176:8240, ack 1, win 501, options [nop,nop,TS val 1197088441 ecr 2072449276], length 64
00:20:47.720235 IP 178.128.225.34.22 > 162.243.188.66.41515: Flags [P.], seq 8240:8464, ack 1, win 501, options [nop,nop,TS val 1197088441 ecr 2072449276], length 224
00:20:47.720295 IP 178.128.225.34.22 > 162.243.188.66.41515: Flags [P.], seq 8464:8528, ack 1, win 501, options [nop,nop,TS val 1197088441 ecr 2072449276], length 64
00:20:47.720328 IP 178.128.225.34.22 > 162.243.188.66.41515: Flags [P.], seq 8528:8736, ack 1, win 501, options [nop,nop,TS val 1197088441 ecr 2072449276], length 208
00:20:47.720384 IP 178.128.225.34.22 > 162.243.188.66.41515: Flags [P.], seq 8736:8800, ack 1, win 501, options [nop,nop,TS val 1197088441 ecr 2072449276], length 64
00:20:47.720436 IP 178.128.225.34.22 > 162.243.188.66.41515: Flags [P.], seq 8800:9024, ack 1, win 501, options [nop,nop,TS val 1197088441 ecr 2072449276], length 224
00:20:47.720490 IP 178.128.225.34.22 > 162.243.188.66.41515: Flags [P.], seq 9024:9088, ack 1, win 501, options [nop,nop,TS val 1197088441 ecr 2072449276], length 64
00:20:47.720515 IP 178.128.225.34.22 > 162.243.188.66.41515: Flags [P.], seq 9088:9296, ack 1, win 501, options [nop,nop,TS val 1197088441 ecr 2072449276], length 208
00:20:47.720573 IP 178.128.225.34.22 > 162.243.188.66.41515: Flags [P.], seq 9296:9568, ack 1, win 501, options [nop,nop,TS val 1197088441 ecr 2072449276], length 272
00:20:47.720629 IP 178.128.225.34.22 > 162.243.188.66.41515: Flags [P.], seq 9568:9632, ack 1, win 501, options [nop,nop,TS val 1197088441 ecr 2072449276], length 64
00:20:47.720646 IP 178.128.225.34.22 > 162.243.188.66.41515: Flags [P.], seq 9632:9840, ack 1, win 501, options [nop,nop,TS val 1197088441 ecr 2072449276], length 208
00:20:47.720682 IP 178.128.225.34.22 > 162.243.188.66.41515: Flags [P.], seq 9840:9904, ack 1, win 501, options [nop,nop,TS val 1197088441 ecr 2072449276], length 64
00:20:47.720723 IP 178.128.225.34.22 > 162.243.188.66.41515: Flags [P.], seq 9904:10112, ack 1, win 501, options [nop,nop,TS val 1197088441 ecr 2072449276], length 208
00:20:47.734021 IP 162.243.188.66.41515 > 178.128.225.34.22: Flags [.], ack 6224, win 898, options [nop,nop,TS val 2072449366 ecr 1197088440], length 0
00:20:47.734097 IP 178.128.225.34.22 > 162.243.188.66.41515: Flags [P.], seq 10112:11808, ack 1, win 501, options [nop,nop,TS val 1197088455 ecr 2072449366], length 1696
00:20:47.734729 IP 162.243.188.66.41515 > 178.128.225.34.22: Flags [.], ack 7952, win 898, options [nop,nop,TS val 2072449366 ecr 1197088440], length 0
00:20:47.734776 IP 162.243.188.66.41515 > 178.128.225.34.22: Flags [.], ack 9568, win 898, options [nop,nop,TS val 2072449367 ecr 1197088441], length 0
00:20:47.748568 IP 162.243.188.66.41515 > 178.128.225.34.22: Flags [.], ack 11560, win 898, options [nop,nop,TS val 2072449380 ecr 1197088441], length 0
00:20:47.773196 IP 162.243.188.66.41515 > 178.128.225.34.22: Flags [.], ack 11808, win 898, options [nop,nop,TS val 2072449405 ecr 1197088455], length 0
00:20:47.823262 IP 178.128.225.34.22 > 162.243.188.66.41515: Flags [P.], seq 11808:12032, ack 1, win 501, options [nop,nop,TS val 1197088544 ecr 2072449405], length 224
00:20:47.823362 IP 178.128.225.34.22 > 162.243.188.66.41515: Flags [P.], seq 12032:12096, ack 1, win 501, options [nop,nop,TS val 1197088544 ecr 2072449405], length 64
00:20:47.823375 IP 178.128.225.34.22 > 162.243.188.66.41515: Flags [P.], seq 12096:12320, ack 1, win 501, options [nop,nop,TS val 1197088544 ecr 2072449405], length 224
00:20:47.823409 IP 178.128.225.34.22 > 162.243.188.66.41515: Flags [P.], seq 12320:12384, ack 1, win 501, options [nop,nop,TS val 1197088544 ecr 2072449405], length 64
00:20:47.823450 IP 178.128.225.34.22 > 162.243.188.66.41515: Flags [P.], seq 12384:12608, ack 1, win 501, options [nop,nop,TS val 1197088544 ecr 2072449405], length 224
00:20:47.823507 IP 178.128.225.34.22 > 162.243.188.66.41515: Flags [P.], seq 12608:12672, ack 1, win 501, options [nop,nop,TS val 1197088544 ecr 2072449405], length 64
00:20:47.823533 IP 178.128.225.34.22 > 162.243.188.66.41515: Flags [P.], seq 12672:12896, ack 1, win 501, options [nop,nop,TS val 1197088544 ecr 2072449405], length 224
00:20:47.823570 IP 178.128.225.34.22 > 162.243.188.66.41515: Flags [P.], seq 12896:12960, ack 1, win 501, options [nop,nop,TS val 1197088544 ecr 2072449405], length 64
00:20:47.823604 IP 178.128.225.34.22 > 162.243.188.66.41515: Flags [P.], seq 12960:13184, ack 1, win 501, options [nop,nop,TS val 1197088544 ecr 2072449405], length 224
00:20:47.823634 IP 178.128.225.34.22 > 162.243.188.66.41515: Flags [P.], seq 13184:13248, ack 1, win 501, options [nop,nop,TS val 1197088544 ecr 2072449405], length 64
00:20:47.823757 IP 178.128.225.34.22 > 162.243.188.66.41515: Flags [P.], seq 13248:13472, ack 1, win 501, options [nop,nop,TS val 1197088544 ecr 2072449405], length 224
00:20:47.823819 IP 178.128.225.34.22 > 162.243.188.66.41515: Flags [P.], seq 13472:13760, ack 1, win 501, options [nop,nop,TS val 1197088544 ecr 2072449405], length 288
00:20:47.823869 IP 178.128.225.34.22 > 162.243.188.66.41515: Flags [P.], seq 13760:13824, ack 1, win 501, options [nop,nop,TS val 1197088544 ecr 2072449405], length 64
00:20:47.823894 IP 178.128.225.34.22 > 162.243.188.66.41515: Flags [P.], seq 13824:14048, ack 1, win 501, options [nop,nop,TS val 1197088544 ecr 2072449405], length 224
00:20:47.824005 IP 178.128.225.34.22 > 162.243.188.66.41515: Flags [P.], seq 14048:14112, ack 1, win 501, options [nop,nop,TS val 1197088544 ecr 2072449405], length 64
00:20:47.824036 IP 178.128.225.34.22 > 162.243.188.66.41515: Flags [P.], seq 14112:14336, ack 1, win 501, options [nop,nop,TS val 1197088545 ecr 2072449405], length 224
00:20:47.824078 IP 178.128.225.34.22 > 162.243.188.66.41515: Flags [P.], seq 14336:14400, ack 1, win 501, options [nop,nop,TS val 1197088545 ecr 2072449405], length 64
00:20:47.824136 IP 178.128.225.34.22 > 162.243.188.66.41515: Flags [P.], seq 14400:14624, ack 1, win 501, options [nop,nop,TS val 1197088545 ecr 2072449405], length 224
00:20:47.824189 IP 178.128.225.34.22 > 162.243.188.66.41515: Flags [P.], seq 14624:14688, ack 1, win 501, options [nop,nop,TS val 1197088545 ecr 2072449405], length 64
00:20:47.824247 IP 178.128.225.34.22 > 162.243.188.66.41515: Flags [P.], seq 14688:14912, ack 1, win 501, options [nop,nop,TS val 1197088545 ecr 2072449405], length 224
00:20:47.824294 IP 178.128.225.34.22 > 162.243.188.66.41515: Flags [P.], seq 14912:14976, ack 1, win 501, options [nop,nop,TS val 1197088545 ecr 2072449405], length 64
00:20:47.824352 IP 178.128.225.34.22 > 162.243.188.66.41515: Flags [P.], seq 14976:15200, ack 1, win 501, options [nop,nop,TS val 1197088545 ecr 2072449405], length 224
00:20:47.824401 IP 178.128.225.34.22 > 162.243.188.66.41515: Flags [P.], seq 15200:15264, ack 1, win 501, options [nop,nop,TS val 1197088545 ecr 2072449405], length 64
00:20:47.824456 IP 178.128.225.34.22 > 162.243.188.66.41515: Flags [P.], seq 15264:15488, ack 1, win 501, options [nop,nop,TS val 1197088545 ecr 2072449405], length 224
00:20:47.824503 IP 178.128.225.34.22 > 162.243.188.66.41515: Flags [P.], seq 15488:15552, ack 1, win 501, options [nop,nop,TS val 1197088545 ecr 2072449405], length 64
00:20:47.824562 IP 178.128.225.34.22 > 162.243.188.66.41515: Flags [P.], seq 15552:15776, ack 1, win 501, options [nop,nop,TS val 1197088545 ecr 2072449405], length 224
00:20:47.824607 IP 178.128.225.34.22 > 162.243.188.66.41515: Flags [P.], seq 15776:15840, ack 1, win 501, options [nop,nop,TS val 1197088545 ecr 2072449405], length 64
00:20:47.824658 IP 178.128.225.34.22 > 162.243.188.66.41515: Flags [P.], seq 15840:16064, ack 1, win 501, options [nop,nop,TS val 1197088545 ecr 2072449405], length 224
00:20:47.824701 IP 178.128.225.34.22 > 162.243.188.66.41515: Flags [P.], seq 16064:16128, ack 1, win 501, options [nop,nop,TS val 1197088545 ecr 2072449405], length 64
00:20:47.824730 IP 178.128.225.34.22 > 162.243.188.66.41515: Flags [P.], seq 16128:16352, ack 1, win 501, options [nop,nop,TS val 1197088545 ecr 2072449405], length 224
00:20:47.824772 IP 178.128.225.34.22 > 162.243.188.66.41515: Flags [P.], seq 16352:16416, ack 1, win 501, options [nop,nop,TS val 1197088545 ecr 2072449405], length 64
00:20:47.824800 IP 178.128.225.34.22 > 162.243.188.66.41515: Flags [P.], seq 16416:16640, ack 1, win 501, options [nop,nop,TS val 1197088545 ecr 2072449405], length 224
00:20:47.824848 IP 178.128.225.34.22 > 162.243.188.66.41515: Flags [P.], seq 16640:16704, ack 1, win 501, options [nop,nop,TS val 1197088545 ecr 2072449405], length 64
00:20:47.824872 IP 178.128.225.34.22 > 162.243.188.66.41515: Flags [P.], seq 16704:16928, ack 1, win 501, options [nop,nop,TS val 1197088545 ecr 2072449405], length 224
00:20:47.824921 IP 178.128.225.34.22 > 162.243.188.66.41515: Flags [P.], seq 16928:16992, ack 1, win 501, options [nop,nop,TS val 1197088545 ecr 2072449405], length 64
00:20:47.824969 IP 178.128.225.34.22 > 162.243.188.66.41515: Flags [P.], seq 16992:17216, ack 1, win 501, options [nop,nop,TS val 1197088545 ecr 2072449405], length 224
00:20:47.825015 IP 178.128.225.34.22 > 162.243.188.66.41515: Flags [P.], seq 17216:17280, ack 1, win 501, options [nop,nop,TS val 1197088546 ecr 2072449405], length 64
00:20:47.825067 IP 178.128.225.34.22 > 162.243.188.66.41515: Flags [P.], seq 17280:17504, ack 1, win 501, options [nop,nop,TS val 1197088546 ecr 2072449405], length 224
00:20:47.825131 IP 178.128.225.34.22 > 162.243.188.66.41515: Flags [P.], seq 17504:17792, ack 1, win 501, options [nop,nop,TS val 1197088546 ecr 2072449405], length 288
00:20:47.825182 IP 178.128.225.34.22 > 162.243.188.66.41515: Flags [P.], seq 17792:17856, ack 1, win 501, options [nop,nop,TS val 1197088546 ecr 2072449405], length 64
00:20:47.825200 IP 178.128.225.34.22 > 162.243.188.66.41515: Flags [P.], seq 17856:18080, ack 1, win 501, options [nop,nop,TS val 1197088546 ecr 2072449405], length 224
00:20:47.825254 IP 178.128.225.34.22 > 162.243.188.66.41515: Flags [P.], seq 18080:18144, ack 1, win 501, options [nop,nop,TS val 1197088546 ecr 2072449405], length 64
00:20:47.825270 IP 178.128.225.34.22 > 162.243.188.66.41515: Flags [P.], seq 18144:18368, ack 1, win 501, options [nop,nop,TS val 1197088546 ecr 2072449405], length 224
00:20:47.825329 IP 178.128.225.34.22 > 162.243.188.66.41515: Flags [P.], seq 18368:18432, ack 1, win 501, options [nop,nop,TS val 1197088546 ecr 2072449405], length 64
00:20:47.825361 IP 178.128.225.34.22 > 162.243.188.66.41515: Flags [P.], seq 18432:18656, ack 1, win 501, options [nop,nop,TS val 1197088546 ecr 2072449405], length 224
00:20:47.825413 IP 178.128.225.34.22 > 162.243.188.66.41515: Flags [P.], seq 18656:18720, ack 1, win 501, options [nop,nop,TS val 1197088546 ecr 2072449405], length 64
00:20:47.825432 IP 178.128.225.34.22 > 162.243.188.66.41515: Flags [P.], seq 18720:18944, ack 1, win 501, options [nop,nop,TS val 1197088546 ecr 2072449405], length 224
00:20:47.825544 IP 178.128.225.34.22 > 162.243.188.66.41515: Flags [P.], seq 18944:19008, ack 1, win 501, options [nop,nop,TS val 1197088546 ecr 2072449405], length 64
00:20:47.825584 IP 178.128.225.34.22 > 162.243.188.66.41515: Flags [P.], seq 19008:19232, ack 1, win 501, options [nop,nop,TS val 1197088546 ecr 2072449405], length 224
00:20:47.825635 IP 178.128.225.34.22 > 162.243.188.66.41515: Flags [P.], seq 19232:19296, ack 1, win 501, options [nop,nop,TS val 1197088546 ecr 2072449405], length 64
00:20:47.825652 IP 178.128.225.34.22 > 162.243.188.66.41515: Flags [P.], seq 19296:19520, ack 1, win 501, options [nop,nop,TS val 1197088546 ecr 2072449405], length 224
00:20:47.825683 IP 178.128.225.34.22 > 162.243.188.66.41515: Flags [P.], seq 19520:19584, ack 1, win 501, options [nop,nop,TS val 1197088546 ecr 2072449405], length 64
00:20:47.825720 IP 178.128.225.34.22 > 162.243.188.66.41515: Flags [P.], seq 19584:19808, ack 1, win 501, options [nop,nop,TS val 1197088546 ecr 2072449405], length 224
00:20:47.825773 IP 178.128.225.34.22 > 162.243.188.66.41515: Flags [P.], seq 19808:19872, ack 1, win 501, options [nop,nop,TS val 1197088546 ecr 2072449405], length 64
00:20:47.825790 IP 178.128.225.34.22 > 162.243.188.66.41515: Flags [P.], seq 19872:20096, ack 1, win 501, options [nop,nop,TS val 1197088546 ecr 2072449405], length 224
00:20:47.825844 IP 178.128.225.34.22 > 162.243.188.66.41515: Flags [P.], seq 20096:20160, ack 1, win 501, options [nop,nop,TS val 1197088546 ecr 2072449405], length 64
00:20:47.825855 IP 178.128.225.34.22 > 162.243.188.66.41515: Flags [P.], seq 20160:20384, ack 1, win 501, options [nop,nop,TS val 1197088546 ecr 2072449405], length 224
00:20:47.825886 IP 178.128.225.34.22 > 162.243.188.66.41515: Flags [P.], seq 20384:20448, ack 1, win 501, options [nop,nop,TS val 1197088546 ecr 2072449405], length 64
00:20:47.825923 IP 178.128.225.34.22 > 162.243.188.66.41515: Flags [P.], seq 20448:20656, ack 1, win 501, options [nop,nop,TS val 1197088546 ecr 2072449405], length 208
00:20:47.825955 IP 178.128.225.34.22 > 162.243.188.66.41515: Flags [P.], seq 20656:20720, ack 1, win 501, options [nop,nop,TS val 1197088546 ecr 2072449405], length 64
00:20:47.825999 IP 178.128.225.34.22 > 162.243.188.66.41515: Flags [P.], seq 20720:20944, ack 1, win 501, options [nop,nop,TS val 1197088547 ecr 2072449405], length 224
00:20:47.826026 IP 178.128.225.34.22 > 162.243.188.66.41515: Flags [P.], seq 20944:21008, ack 1, win 501, options [nop,nop,TS val 1197088547 ecr 2072449405], length 64
00:20:47.838064 IP 162.243.188.66.41515 > 178.128.225.34.22: Flags [.], ack 13472, win 898, options [nop,nop,TS val 2072449470 ecr 1197088544], length 0
00:20:47.838141 IP 178.128.225.34.22 > 162.243.188.66.41515: Flags [P.], seq 21008:22096, ack 1, win 501, options [nop,nop,TS val 1197088559 ecr 2072449470], length 1088
00:20:47.838608 IP 162.243.188.66.41515 > 178.128.225.34.22: Flags [.], ack 14976, win 898, options [nop,nop,TS val 2072449471 ecr 1197088544], length 0
00:20:47.839027 IP 162.243.188.66.41515 > 178.128.225.34.22: Flags [.], ack 16640, win 898, options [nop,nop,TS val 2072449471 ecr 1197088545], length 0
00:20:47.839516 IP 162.243.188.66.41515 > 178.128.225.34.22: Flags [.], ack 18144, win 898, options [nop,nop,TS val 2072449472 ecr 1197088545], length 0
00:20:47.840012 IP 162.243.188.66.41515 > 178.128.225.34.22: Flags [.], ack 19808, win 898, options [nop,nop,TS val 2072449472 ecr 1197088546], length 0
00:20:47.852492 IP 162.243.188.66.41515 > 178.128.225.34.22: Flags [.], ack 22096, win 898, options [nop,nop,TS val 2072449484 ecr 1197088546], length 0
00:20:47.927289 IP 178.128.225.34.22 > 162.243.188.66.41515: Flags [P.], seq 22096:22320, ack 1, win 501, options [nop,nop,TS val 1197088648 ecr 2072449484], length 224
00:20:47.927405 IP 178.128.225.34.22 > 162.243.188.66.41515: Flags [P.], seq 22320:22384, ack 1, win 501, options [nop,nop,TS val 1197088648 ecr 2072449484], length 64
00:20:47.927466 IP 178.128.225.34.22 > 162.243.188.66.41515: Flags [P.], seq 22384:22608, ack 1, win 501, options [nop,nop,TS val 1197088648 ecr 2072449484], length 224
00:20:47.927520 IP 178.128.225.34.22 > 162.243.188.66.41515: Flags [P.], seq 22608:22672, ack 1, win 501, options [nop,nop,TS val 1197088648 ecr 2072449484], length 64
00:20:47.927543 IP 178.128.225.34.22 > 162.243.188.66.41515: Flags [P.], seq 22672:22896, ack 1, win 501, options [nop,nop,TS val 1197088648 ecr 2072449484], length 224
00:20:47.927608 IP 178.128.225.34.22 > 162.243.188.66.41515: Flags [P.], seq 22896:22960, ack 1, win 501, options [nop,nop,TS val 1197088648 ecr 2072449484], length 64
00:20:47.927628 IP 178.128.225.34.22 > 162.243.188.66.41515: Flags [P.], seq 22960:23184, ack 1, win 501, options [nop,nop,TS val 1197088648 ecr 2072449484], length 224
00:20:47.927659 IP 178.128.225.34.22 > 162.243.188.66.41515: Flags [P.], seq 23184:23248, ack 1, win 501, options [nop,nop,TS val 1197088648 ecr 2072449484], length 64
00:20:47.927699 IP 178.128.225.34.22 > 162.243.188.66.41515: Flags [P.], seq 23248:23472, ack 1, win 501, options [nop,nop,TS val 1197088648 ecr 2072449484], length 224
00:20:47.927807 IP 178.128.225.34.22 > 162.243.188.66.41515: Flags [P.], seq 23472:24048, ack 1, win 501, options [nop,nop,TS val 1197088648 ecr 2072449484], length 576
00:20:47.927844 IP 178.128.225.34.22 > 162.243.188.66.41515: Flags [P.], seq 24048:24112, ack 1, win 501, options [nop,nop,TS val 1197088648 ecr 2072449484], length 64
00:20:47.927881 IP 178.128.225.34.22 > 162.243.188.66.41515: Flags [P.], seq 24112:24336, ack 1, win 501, options [nop,nop,TS val 1197088648 ecr 2072449484], length 224
00:20:47.927919 IP 178.128.225.34.22 > 162.243.188.66.41515: Flags [P.], seq 24336:24400, ack 1, win 501, options [nop,nop,TS val 1197088648 ecr 2072449484], length 64
00:20:47.927969 IP 178.128.225.34.22 > 162.243.188.66.41515: Flags [P.], seq 24400:24624, ack 1, win 501, options [nop,nop,TS val 1197088648 ecr 2072449484], length 224
00:20:47.928024 IP 178.128.225.34.22 > 162.243.188.66.41515: Flags [P.], seq 24624:24688, ack 1, win 501, options [nop,nop,TS val 1197088649 ecr 2072449484], length 64
00:20:47.928040 IP 178.128.225.34.22 > 162.243.188.66.41515: Flags [P.], seq 24688:24912, ack 1, win 501, options [nop,nop,TS val 1197088649 ecr 2072449484], length 224
00:20:47.928074 IP 178.128.225.34.22 > 162.243.188.66.41515: Flags [P.], seq 24912:24976, ack 1, win 501, options [nop,nop,TS val 1197088649 ecr 2072449484], length 64
00:20:47.928114 IP 178.128.225.34.22 > 162.243.188.66.41515: Flags [P.], seq 24976:25200, ack 1, win 501, options [nop,nop,TS val 1197088649 ecr 2072449484], length 224
00:20:47.928183 IP 178.128.225.34.22 > 162.243.188.66.41515: Flags [P.], seq 25200:25264, ack 1, win 501, options [nop,nop,TS val 1197088649 ecr 2072449484], length 64
00:20:47.928203 IP 178.128.225.34.22 > 162.243.188.66.41515: Flags [P.], seq 25264:25488, ack 1, win 501, options [nop,nop,TS val 1197088649 ecr 2072449484], length 224
00:20:47.928234 IP 178.128.225.34.22 > 162.243.188.66.41515: Flags [P.], seq 25488:25552, ack 1, win 501, options [nop,nop,TS val 1197088649 ecr 2072449484], length 64
00:20:47.928272 IP 178.128.225.34.22 > 162.243.188.66.41515: Flags [P.], seq 25552:25776, ack 1, win 501, options [nop,nop,TS val 1197088649 ecr 2072449484], length 224
00:20:47.928341 IP 178.128.225.34.22 > 162.243.188.66.41515: Flags [P.], seq 25776:25840, ack 1, win 501, options [nop,nop,TS val 1197088649 ecr 2072449484], length 64
00:20:47.928358 IP 178.128.225.34.22 > 162.243.188.66.41515: Flags [P.], seq 25840:26064, ack 1, win 501, options [nop,nop,TS val 1197088649 ecr 2072449484], length 224
00:20:47.928390 IP 178.128.225.34.22 > 162.243.188.66.41515: Flags [P.], seq 26064:26128, ack 1, win 501, options [nop,nop,TS val 1197088649 ecr 2072449484], length 64
00:20:47.928432 IP 178.128.225.34.22 > 162.243.188.66.41515: Flags [P.], seq 26128:26352, ack 1, win 501, options [nop,nop,TS val 1197088649 ecr 2072449484], length 224
00:20:47.928470 IP 178.128.225.34.22 > 162.243.188.66.41515: Flags [P.], seq 26352:26416, ack 1, win 501, options [nop,nop,TS val 1197088649 ecr 2072449484], length 64
00:20:47.928529 IP 178.128.225.34.22 > 162.243.188.66.41515: Flags [P.], seq 26416:26640, ack 1, win 501, options [nop,nop,TS val 1197088649 ecr 2072449484], length 224
00:20:47.928578 IP 178.128.225.34.22 > 162.243.188.66.41515: Flags [P.], seq 26640:26704, ack 1, win 501, options [nop,nop,TS val 1197088649 ecr 2072449484], length 64
00:20:47.928632 IP 178.128.225.34.22 > 162.243.188.66.41515: Flags [P.], seq 26704:26928, ack 1, win 501, options [nop,nop,TS val 1197088649 ecr 2072449484], length 224
00:20:47.928696 IP 178.128.225.34.22 > 162.243.188.66.41515: Flags [P.], seq 26928:27216, ack 1, win 501, options [nop,nop,TS val 1197088649 ecr 2072449484], length 288
00:20:47.928735 IP 178.128.225.34.22 > 162.243.188.66.41515: Flags [P.], seq 27216:27280, ack 1, win 501, options [nop,nop,TS val 1197088649 ecr 2072449484], length 64
00:20:47.928776 IP 178.128.225.34.22 > 162.243.188.66.41515: Flags [P.], seq 27280:27504, ack 1, win 501, options [nop,nop,TS val 1197088649 ecr 2072449484], length 224
00:20:47.928813 IP 178.128.225.34.22 > 162.243.188.66.41515: Flags [P.], seq 27504:27568, ack 1, win 501, options [nop,nop,TS val 1197088649 ecr 2072449484], length 64
00:20:47.928863 IP 178.128.225.34.22 > 162.243.188.66.41515: Flags [P.], seq 27568:27792, ack 1, win 501, options [nop,nop,TS val 1197088649 ecr 2072449484], length 224
00:20:47.928926 IP 178.128.225.34.22 > 162.243.188.66.41515: Flags [P.], seq 27792:27856, ack 1, win 501, options [nop,nop,TS val 1197088649 ecr 2072449484], length 64
00:20:47.928951 IP 178.128.225.34.22 > 162.243.188.66.41515: Flags [P.], seq 27856:28080, ack 1, win 501, options [nop,nop,TS val 1197088649 ecr 2072449484], length 224
00:20:47.928990 IP 178.128.225.34.22 > 162.243.188.66.41515: Flags [P.], seq 28080:28144, ack 1, win 501, options [nop,nop,TS val 1197088650 ecr 2072449484], length 64
00:20:47.929026 IP 178.128.225.34.22 > 162.243.188.66.41515: Flags [P.], seq 28144:28368, ack 1, win 501, options [nop,nop,TS val 1197088650 ecr 2072449484], length 224
00:20:47.929062 IP 178.128.225.34.22 > 162.243.188.66.41515: Flags [P.], seq 28368:28432, ack 1, win 501, options [nop,nop,TS val 1197088650 ecr 2072449484], length 64
00:20:47.929097 IP 178.128.225.34.22 > 162.243.188.66.41515: Flags [P.], seq 28432:28656, ack 1, win 501, options [nop,nop,TS val 1197088650 ecr 2072449484], length 224
00:20:47.929133 IP 178.128.225.34.22 > 162.243.188.66.41515: Flags [P.], seq 28656:28720, ack 1, win 501, options [nop,nop,TS val 1197088650 ecr 2072449484], length 64
00:20:47.929169 IP 178.128.225.34.22 > 162.243.188.66.41515: Flags [P.], seq 28720:28944, ack 1, win 501, options [nop,nop,TS val 1197088650 ecr 2072449484], length 224
00:20:47.929205 IP 178.128.225.34.22 > 162.243.188.66.41515: Flags [P.], seq 28944:29008, ack 1, win 501, options [nop,nop,TS val 1197088650 ecr 2072449484], length 64
00:20:47.929241 IP 178.128.225.34.22 > 162.243.188.66.41515: Flags [P.], seq 29008:29296, ack 1, win 501, options [nop,nop,TS val 1197088650 ecr 2072449484], length 288
00:20:47.929280 IP 178.128.225.34.22 > 162.243.188.66.41515: Flags [P.], seq 29296:29520, ack 1, win 501, options [nop,nop,TS val 1197088650 ecr 2072449484], length 224
00:20:47.929316 IP 178.128.225.34.22 > 162.243.188.66.41515: Flags [P.], seq 29520:29584, ack 1, win 501, options [nop,nop,TS val 1197088650 ecr 2072449484], length 64
00:20:47.929352 IP 178.128.225.34.22 > 162.243.188.66.41515: Flags [P.], seq 29584:29808, ack 1, win 501, options [nop,nop,TS val 1197088650 ecr 2072449484], length 224
00:20:47.929386 IP 178.128.225.34.22 > 162.243.188.66.41515: Flags [P.], seq 29808:29872, ack 1, win 501, options [nop,nop,TS val 1197088650 ecr 2072449484], length 64
00:20:47.929433 IP 178.128.225.34.22 > 162.243.188.66.41515: Flags [P.], seq 29872:30096, ack 1, win 501, options [nop,nop,TS val 1197088650 ecr 2072449484], length 224
00:20:47.929463 IP 178.128.225.34.22 > 162.243.188.66.41515: Flags [P.], seq 30096:30160, ack 1, win 501, options [nop,nop,TS val 1197088650 ecr 2072449484], length 64
00:20:47.929509 IP 178.128.225.34.22 > 162.243.188.66.41515: Flags [P.], seq 30160:30384, ack 1, win 501, options [nop,nop,TS val 1197088650 ecr 2072449484], length 224
00:20:47.929563 IP 178.128.225.34.22 > 162.243.188.66.41515: Flags [P.], seq 30384:30448, ack 1, win 501, options [nop,nop,TS val 1197088650 ecr 2072449484], length 64
00:20:47.929577 IP 178.128.225.34.22 > 162.243.188.66.41515: Flags [P.], seq 30448:30672, ack 1, win 501, options [nop,nop,TS val 1197088650 ecr 2072449484], length 224
00:20:47.929634 IP 178.128.225.34.22 > 162.243.188.66.41515: Flags [P.], seq 30672:30736, ack 1, win 501, options [nop,nop,TS val 1197088650 ecr 2072449484], length 64
00:20:47.929650 IP 178.128.225.34.22 > 162.243.188.66.41515: Flags [P.], seq 30736:30960, ack 1, win 501, options [nop,nop,TS val 1197088650 ecr 2072449484], length 224
00:20:47.929677 IP 178.128.225.34.22 > 162.243.188.66.41515: Flags [P.], seq 30960:31024, ack 1, win 501, options [nop,nop,TS val 1197088650 ecr 2072449484], length 64
00:20:47.929714 IP 178.128.225.34.22 > 162.243.188.66.41515: Flags [P.], seq 31024:31248, ack 1, win 501, options [nop,nop,TS val 1197088650 ecr 2072449484], length 224
00:20:47.929768 IP 178.128.225.34.22 > 162.243.188.66.41515: Flags [P.], seq 31248:31312, ack 1, win 501, options [nop,nop,TS val 1197088650 ecr 2072449484], length 64
00:20:47.929788 IP 178.128.225.34.22 > 162.243.188.66.41515: Flags [P.], seq 31312:31536, ack 1, win 501, options [nop,nop,TS val 1197088650 ecr 2072449484], length 224
00:20:47.929856 IP 178.128.225.34.22 > 162.243.188.66.41515: Flags [P.], seq 31536:31600, ack 1, win 501, options [nop,nop,TS val 1197088650 ecr 2072449484], length 64
00:20:47.929875 IP 178.128.225.34.22 > 162.243.188.66.41515: Flags [P.], seq 31600:31824, ack 1, win 501, options [nop,nop,TS val 1197088650 ecr 2072449484], length 224
00:20:47.929938 IP 178.128.225.34.22 > 162.243.188.66.41515: Flags [P.], seq 31824:31888, ack 1, win 501, options [nop,nop,TS val 1197088650 ecr 2072449484], length 64
00:20:47.929977 IP 178.128.225.34.22 > 162.243.188.66.41515: Flags [P.], seq 31888:32112, ack 1, win 501, options [nop,nop,TS val 1197088650 ecr 2072449484], length 224
00:20:47.930024 IP 178.128.225.34.22 > 162.243.188.66.41515: Flags [P.], seq 32112:32176, ack 1, win 501, options [nop,nop,TS val 1197088651 ecr 2072449484], length 64
00:20:47.930079 IP 178.128.225.34.22 > 162.243.188.66.41515: Flags [P.], seq 32176:32400, ack 1, win 501, options [nop,nop,TS val 1197088651 ecr 2072449484], length 224
00:20:47.930160 IP 178.128.225.34.22 > 162.243.188.66.41515: Flags [P.], seq 32400:32688, ack 1, win 501, options [nop,nop,TS val 1197088651 ecr 2072449484], length 288
00:20:47.930340 IP 178.128.225.34.22 > 162.243.188.66.41515: Flags [P.], seq 32688:32752, ack 1, win 501, options [nop,nop,TS val 1197088651 ecr 2072449484], length 64
00:20:47.930601 IP 178.128.225.34.22 > 162.243.188.66.41515: Flags [P.], seq 32752:33312, ack 1, win 501, options [nop,nop,TS val 1197088651 ecr 2072449484], length 560
00:20:47.930729 IP 178.128.225.34.22 > 162.243.188.66.41515: Flags [P.], seq 33312:34048, ack 1, win 501, options [nop,nop,TS val 1197088651 ecr 2072449484], length 736
00:20:47.930849 IP 178.128.225.34.22 > 162.243.188.66.41515: Flags [P.], seq 34048:34608, ack 1, win 501, options [nop,nop,TS val 1197088651 ecr 2072449484], length 560
00:20:47.931009 IP 178.128.225.34.22 > 162.243.188.66.41515: Flags [P.], seq 34608:35344, ack 1, win 501, options [nop,nop,TS val 1197088651 ecr 2072449484], length 736
00:20:47.931135 IP 178.128.225.34.22 > 162.243.188.66.41515: Flags [P.], seq 35344:35904, ack 1, win 501, options [nop,nop,TS val 1197088652 ecr 2072449484], length 560
00:20:47.931241 IP 178.128.225.34.22 > 162.243.188.66.41515: Flags [P.], seq 35904:36464, ack 1, win 501, options [nop,nop,TS val 1197088652 ecr 2072449484], length 560
00:20:47.931342 IP 178.128.225.34.22 > 162.243.188.66.41515: Flags [P.], seq 36464:37200, ack 1, win 501, options [nop,nop,TS val 1197088652 ecr 2072449484], length 736
00:20:47.931414 IP 178.128.225.34.22 > 162.243.188.66.41515: Flags [P.], seq 37200:37744, ack 1, win 501, options [nop,nop,TS val 1197088652 ecr 2072449484], length 544
00:20:47.931483 IP 178.128.225.34.22 > 162.243.188.66.41515: Flags [P.], seq 37744:38256, ack 1, win 501, options [nop,nop,TS val 1197088652 ecr 2072449484], length 512
00:20:47.931551 IP 178.128.225.34.22 > 162.243.188.66.41515: Flags [P.], seq 38256:38624, ack 1, win 501, options [nop,nop,TS val 1197088652 ecr 2072449484], length 368
00:20:47.931601 IP 178.128.225.34.22 > 162.243.188.66.41515: Flags [P.], seq 38624:38688, ack 1, win 501, options [nop,nop,TS val 1197088652 ecr 2072449484], length 64
00:20:47.942113 IP 162.243.188.66.41515 > 178.128.225.34.22: Flags [.], ack 24048, win 898, options [nop,nop,TS val 2072449574 ecr 1197088648], length 0
00:20:47.942715 IP 162.243.188.66.41515 > 178.128.225.34.22: Flags [.], ack 25552, win 898, options [nop,nop,TS val 2072449574 ecr 1197088648], length 0
00:20:47.942981 IP 162.243.188.66.41515 > 178.128.225.34.22: Flags [.], ack 27216, win 898, options [nop,nop,TS val 2072449575 ecr 1197088649], length 0
00:20:47.943552 IP 162.243.188.66.41515 > 178.128.225.34.22: Flags [.], ack 28720, win 898, options [nop,nop,TS val 2072449575 ecr 1197088649], length 0
00:20:47.944250 IP 162.243.188.66.41515 > 178.128.225.34.22: Flags [.], ack 30384, win 898, options [nop,nop,TS val 2072449576 ecr 1197088650], length 0
00:20:47.944251 IP 162.243.188.66.41515 > 178.128.225.34.22: Flags [.], ack 31888, win 898, options [nop,nop,TS val 2072449576 ecr 1197088650], length 0
00:20:47.944989 IP 162.243.188.66.41515 > 178.128.225.34.22: Flags [.], ack 34048, win 898, options [nop,nop,TS val 2072449577 ecr 1197088650], length 0
00:20:47.945334 IP 162.243.188.66.41515 > 178.128.225.34.22: Flags [.], ack 35904, win 898, options [nop,nop,TS val 2072449577 ecr 1197088651], length 0
00:20:47.945569 IP 162.243.188.66.41515 > 178.128.225.34.22: Flags [.], ack 37200, win 898, options [nop,nop,TS val 2072449578 ecr 1197088652], length 0
00:20:47.945668 IP 162.243.188.66.41515 > 178.128.225.34.22: Flags [.], ack 38256, win 898, options [nop,nop,TS val 2072449578 ecr 1197088652], length 0
00:20:47.983064 IP 178.128.225.34.22 > 162.243.188.66.41515: Flags [P.], seq 38624:38688, ack 1, win 501, options [nop,nop,TS val 1197088704 ecr 2072449578], length 64
00:20:47.988160 IP 162.243.188.66.41515 > 178.128.225.34.22: Flags [.], ack 38688, win 898, options [nop,nop,TS val 2072449620 ecr 1197088652], length 0
00:20:47.997381 IP 162.243.188.66.41515 > 178.128.225.34.22: Flags [.], ack 38688, win 898, options [nop,nop,TS val 2072449629 ecr 1197088704,nop,nop,sack 1 {38624:38688}], length 0
00:20:48.031346 IP 178.128.225.34.22 > 162.243.188.66.41515: Flags [P.], seq 38688:38912, ack 1, win 501, options [nop,nop,TS val 1197088752 ecr 2072449629], length 224
00:20:48.031625 IP 178.128.225.34.22 > 162.243.188.66.41515: Flags [P.], seq 38912:40496, ack 1, win 501, options [nop,nop,TS val 1197088752 ecr 2072449629], length 1584
00:20:48.031914 IP 178.128.225.34.22 > 162.243.188.66.41515: Flags [P.], seq 40496:42032, ack 1, win 501, options [nop,nop,TS val 1197088752 ecr 2072449629], length 1536
00:20:48.031982 IP 178.128.225.34.22 > 162.243.188.66.41515: Flags [P.], seq 42032:42432, ack 1, win 501, options [nop,nop,TS val 1197088752 ecr 2072449629], length 400
00:20:48.032085 IP 178.128.225.34.22 > 162.243.188.66.41515: Flags [P.], seq 42432:42992, ack 1, win 501, options [nop,nop,TS val 1197088753 ecr 2072449629], length 560
00:20:48.032173 IP 178.128.225.34.22 > 162.243.188.66.41515: Flags [P.], seq 42992:43392, ack 1, win 501, options [nop,nop,TS val 1197088753 ecr 2072449629], length 400
00:20:48.032253 IP 178.128.225.34.22 > 162.243.188.66.41515: Flags [P.], seq 43392:43792, ack 1, win 501, options [nop,nop,TS val 1197088753 ecr 2072449629], length 400
00:20:48.032332 IP 178.128.225.34.22 > 162.243.188.66.41515: Flags [P.], seq 43792:44192, ack 1, win 501, options [nop,nop,TS val 1197088753 ecr 2072449629], length 400
00:20:48.032417 IP 178.128.225.34.22 > 162.243.188.66.41515: Flags [P.], seq 44192:44592, ack 1, win 501, options [nop,nop,TS val 1197088753 ecr 2072449629], length 400
00:20:48.032518 IP 178.128.225.34.22 > 162.243.188.66.41515: Flags [P.], seq 44592:45152, ack 1, win 501, options [nop,nop,TS val 1197088753 ecr 2072449629], length 560
00:20:48.032620 IP 178.128.225.34.22 > 162.243.188.66.41515: Flags [P.], seq 45152:45552, ack 1, win 501, options [nop,nop,TS val 1197088753 ecr 2072449629], length 400
00:20:48.032722 IP 178.128.225.34.22 > 162.243.188.66.41515: Flags [P.], seq 45552:45952, ack 1, win 501, options [nop,nop,TS val 1197088753 ecr 2072449629], length 400
00:20:48.032776 IP 178.128.225.34.22 > 162.243.188.66.41515: Flags [P.], seq 45952:46352, ack 1, win 501, options [nop,nop,TS val 1197088753 ecr 2072449629], length 400
00:20:48.032836 IP 178.128.225.34.22 > 162.243.188.66.41515: Flags [P.], seq 46352:46752, ack 1, win 501, options [nop,nop,TS val 1197088753 ecr 2072449629], length 400
00:20:48.032864 IP 178.128.225.34.22 > 162.243.188.66.41515: Flags [P.], seq 46752:47312, ack 1, win 501, options [nop,nop,TS val 1197088753 ecr 2072449629], length 560
00:20:48.032928 IP 178.128.225.34.22 > 162.243.188.66.41515: Flags [P.], seq 47312:47536, ack 1, win 501, options [nop,nop,TS val 1197088753 ecr 2072449629], length 224
00:20:48.032982 IP 178.128.225.34.22 > 162.243.188.66.41515: Flags [P.], seq 47536:47600, ack 1, win 501, options [nop,nop,TS val 1197088753 ecr 2072449629], length 64
00:20:48.033030 IP 178.128.225.34.22 > 162.243.188.66.41515: Flags [P.], seq 47600:47824, ack 1, win 501, options [nop,nop,TS val 1197088754 ecr 2072449629], length 224
00:20:48.033093 IP 178.128.225.34.22 > 162.243.188.66.41515: Flags [P.], seq 47824:47888, ack 1, win 501, options [nop,nop,TS val 1197088754 ecr 2072449629], length 64
00:20:48.033108 IP 178.128.225.34.22 > 162.243.188.66.41515: Flags [P.], seq 47888:48112, ack 1, win 501, options [nop,nop,TS val 1197088754 ecr 2072449629], length 224
00:20:48.033198 IP 178.128.225.34.22 > 162.243.188.66.41515: Flags [P.], seq 48112:48672, ack 1, win 501, options [nop,nop,TS val 1197088754 ecr 2072449629], length 560
00:20:48.033268 IP 178.128.225.34.22 > 162.243.188.66.41515: Flags [P.], seq 48672:49072, ack 1, win 501, options [nop,nop,TS val 1197088754 ecr 2072449629], length 400
00:20:48.033341 IP 178.128.225.34.22 > 162.243.188.66.41515: Flags [P.], seq 49072:49632, ack 1, win 501, options [nop,nop,TS val 1197088754 ecr 2072449629], length 560
00:20:48.033400 IP 178.128.225.34.22 > 162.243.188.66.41515: Flags [P.], seq 49632:50032, ack 1, win 501, options [nop,nop,TS val 1197088754 ecr 2072449629], length 400
00:20:48.033461 IP 178.128.225.34.22 > 162.243.188.66.41515: Flags [P.], seq 50032:50432, ack 1, win 501, options [nop,nop,TS val 1197088754 ecr 2072449629], length 400
00:20:48.033522 IP 178.128.225.34.22 > 162.243.188.66.41515: Flags [P.], seq 50432:50832, ack 1, win 501, options [nop,nop,TS val 1197088754 ecr 2072449629], length 400
00:20:48.033580 IP 178.128.225.34.22 > 162.243.188.66.41515: Flags [P.], seq 50832:51232, ack 1, win 501, options [nop,nop,TS val 1197088754 ecr 2072449629], length 400
00:20:48.033651 IP 178.128.225.34.22 > 162.243.188.66.41515: Flags [P.], seq 51232:51792, ack 1, win 501, options [nop,nop,TS val 1197088754 ecr 2072449629], length 560
00:20:48.033711 IP 178.128.225.34.22 > 162.243.188.66.41515: Flags [P.], seq 51792:52192, ack 1, win 501, options [nop,nop,TS val 1197088754 ecr 2072449629], length 400
00:20:48.033847 IP 178.128.225.34.22 > 162.243.188.66.41515: Flags [P.], seq 52192:52592, ack 1, win 501, options [nop,nop,TS val 1197088754 ecr 2072449629], length 400
00:20:48.033900 IP 178.128.225.34.22 > 162.243.188.66.41515: Flags [P.], seq 52592:52816, ack 1, win 501, options [nop,nop,TS val 1197088754 ecr 2072449629], length 224
00:20:48.033948 IP 178.128.225.34.22 > 162.243.188.66.41515: Flags [P.], seq 52816:53376, ack 1, win 501, options [nop,nop,TS val 1197088754 ecr 2072449629], length 560
00:20:48.034018 IP 178.128.225.34.22 > 162.243.188.66.41515: Flags [P.], seq 53376:53936, ack 1, win 501, options [nop,nop,TS val 1197088755 ecr 2072449629], length 560
00:20:48.034139 IP 178.128.225.34.22 > 162.243.188.66.41515: Flags [P.], seq 53936:54688, ack 1, win 501, options [nop,nop,TS val 1197088755 ecr 2072449629], length 752
00:20:48.034382 IP 178.128.225.34.22 > 162.243.188.66.41515: Flags [P.], seq 54688:55056, ack 1, win 501, options [nop,nop,TS val 1197088755 ecr 2072449629], length 368
00:20:48.034610 IP 178.128.225.34.22 > 162.243.188.66.41515: Flags [P.], seq 55056:56384, ack 1, win 501, options [nop,nop,TS val 1197088755 ecr 2072449629], length 1328
00:20:48.045721 IP 162.243.188.66.41515 > 178.128.225.34.22: Flags [.], ack 38912, win 898, options [nop,nop,TS val 2072449678 ecr 1197088752], length 0
00:20:48.046110 IP 162.243.188.66.41515 > 178.128.225.34.22: Flags [.], ack 40496, win 898, options [nop,nop,TS val 2072449678 ecr 1197088752], length 0
00:20:48.046130 IP 162.243.188.66.41515 > 178.128.225.34.22: Flags [.], ack 41944, win 898, options [nop,nop,TS val 2072449678 ecr 1197088752], length 0
00:20:48.046130 IP 162.243.188.66.41515 > 178.128.225.34.22: Flags [.], ack 42032, win 898, options [nop,nop,TS val 2072449678 ecr 1197088752], length 0
00:20:48.046524 IP 162.243.188.66.41515 > 178.128.225.34.22: Flags [.], ack 42432, win 898, options [nop,nop,TS val 2072449678 ecr 1197088752], length 0
00:20:48.046524 IP 162.243.188.66.41515 > 178.128.225.34.22: Flags [.], ack 42992, win 898, options [nop,nop,TS val 2072449678 ecr 1197088753], length 0
00:20:48.046524 IP 162.243.188.66.41515 > 178.128.225.34.22: Flags [.], ack 43392, win 898, options [nop,nop,TS val 2072449678 ecr 1197088753], length 0
00:20:48.046524 IP 162.243.188.66.41515 > 178.128.225.34.22: Flags [.], ack 43792, win 898, options [nop,nop,TS val 2072449678 ecr 1197088753], length 0
00:20:48.046524 IP 162.243.188.66.41515 > 178.128.225.34.22: Flags [.], ack 44192, win 898, options [nop,nop,TS val 2072449679 ecr 1197088753], length 0
00:20:48.046677 IP 162.243.188.66.41515 > 178.128.225.34.22: Flags [.], ack 44592, win 898, options [nop,nop,TS val 2072449679 ecr 1197088753], length 0
00:20:48.046718 IP 162.243.188.66.41515 > 178.128.225.34.22: Flags [.], ack 45152, win 898, options [nop,nop,TS val 2072449679 ecr 1197088753], length 0
00:20:48.046888 IP 162.243.188.66.41515 > 178.128.225.34.22: Flags [.], ack 45552, win 898, options [nop,nop,TS val 2072449679 ecr 1197088753], length 0
00:20:48.046914 IP 162.243.188.66.41515 > 178.128.225.34.22: Flags [.], ack 45952, win 898, options [nop,nop,TS val 2072449679 ecr 1197088753], length 0
00:20:48.046953 IP 162.243.188.66.41515 > 178.128.225.34.22: Flags [.], ack 46352, win 898, options [nop,nop,TS val 2072449679 ecr 1197088753], length 0
00:20:48.047020 IP 162.243.188.66.41515 > 178.128.225.34.22: Flags [.], ack 46752, win 898, options [nop,nop,TS val 2072449679 ecr 1197088753], length 0
00:20:48.047381 IP 162.243.188.66.41515 > 178.128.225.34.22: Flags [.], ack 48672, win 898, options [nop,nop,TS val 2072449679 ecr 1197088753], length 0
00:20:48.047661 IP 162.243.188.66.41515 > 178.128.225.34.22: Flags [.], ack 50432, win 898, options [nop,nop,TS val 2072449680 ecr 1197088754], length 0
00:20:48.047938 IP 162.243.188.66.41515 > 178.128.225.34.22: Flags [.], ack 52192, win 898, options [nop,nop,TS val 2072449680 ecr 1197088754], length 0
00:20:48.048293 IP 162.243.188.66.41515 > 178.128.225.34.22: Flags [.], ack 53936, win 898, options [nop,nop,TS val 2072449680 ecr 1197088754], length 0
00:20:48.048635 IP 162.243.188.66.41515 > 178.128.225.34.22: Flags [.], ack 55056, win 898, options [nop,nop,TS val 2072449681 ecr 1197088755], length 0
00:20:48.096181 IP 162.243.188.66.41515 > 178.128.225.34.22: Flags [.], ack 56384, win 898, options [nop,nop,TS val 2072449728 ecr 1197088755], length 0
00:20:48.135378 IP 178.128.225.34.22 > 162.243.188.66.41515: Flags [P.], seq 56384:57120, ack 1, win 501, options [nop,nop,TS val 1197088856 ecr 2072449728], length 736
00:20:48.135631 IP 178.128.225.34.22 > 162.243.188.66.41515: Flags [P.], seq 57120:59552, ack 1, win 501, options [nop,nop,TS val 1197088856 ecr 2072449728], length 2432
00:20:48.135731 IP 178.128.225.34.22 > 162.243.188.66.41515: Flags [P.], seq 59552:60464, ack 1, win 501, options [nop,nop,TS val 1197088856 ecr 2072449728], length 912
00:20:48.135802 IP 178.128.225.34.22 > 162.243.188.66.41515: Flags [P.], seq 60464:61024, ack 1, win 501, options [nop,nop,TS val 1197088856 ecr 2072449728], length 560
00:20:48.135862 IP 178.128.225.34.22 > 162.243.188.66.41515: Flags [P.], seq 61024:61424, ack 1, win 501, options [nop,nop,TS val 1197088856 ecr 2072449728], length 400
00:20:48.135996 IP 178.128.225.34.22 > 162.243.188.66.41515: Flags [P.], seq 61424:61984, ack 1, win 501, options [nop,nop,TS val 1197088857 ecr 2072449728], length 560
00:20:48.136162 IP 178.128.225.34.22 > 162.243.188.66.41515: Flags [P.], seq 61984:63664, ack 1, win 501, options [nop,nop,TS val 1197088857 ecr 2072449728], length 1680
00:20:48.136251 IP 178.128.225.34.22 > 162.243.188.66.41515: Flags [P.], seq 63664:64176, ack 1, win 501, options [nop,nop,TS val 1197088857 ecr 2072449728], length 512
00:20:48.136355 IP 178.128.225.34.22 > 162.243.188.66.41515: Flags [P.], seq 64176:64688, ack 1, win 501, options [nop,nop,TS val 1197088857 ecr 2072449728], length 512
00:20:48.136439 IP 178.128.225.34.22 > 162.243.188.66.41515: Flags [P.], seq 64688:65360, ack 1, win 501, options [nop,nop,TS val 1197088857 ecr 2072449728], length 672
00:20:48.136497 IP 178.128.225.34.22 > 162.243.188.66.41515: Flags [P.], seq 65360:65728, ack 1, win 501, options [nop,nop,TS val 1197088857 ecr 2072449728], length 368
00:20:48.136563 IP 178.128.225.34.22 > 162.243.188.66.41515: Flags [P.], seq 65728:66240, ack 1, win 501, options [nop,nop,TS val 1197088857 ecr 2072449728], length 512
00:20:48.136615 IP 178.128.225.34.22 > 162.243.188.66.41515: Flags [P.], seq 66240:66448, ack 1, win 501, options [nop,nop,TS val 1197088857 ecr 2072449728], length 208
00:20:48.149902 IP 162.243.188.66.41515 > 178.128.225.34.22: Flags [.], ack 58568, win 898, options [nop,nop,TS val 2072449782 ecr 1197088856], length 0
00:20:48.149954 IP 162.243.188.66.41515 > 178.128.225.34.22: Flags [.], ack 60464, win 898, options [nop,nop,TS val 2072449782 ecr 1197088856], length 0
00:20:48.150442 IP 162.243.188.66.41515 > 178.128.225.34.22: Flags [.], ack 61984, win 898, options [nop,nop,TS val 2072449782 ecr 1197088856], length 0
00:20:48.150576 IP 162.243.188.66.41515 > 178.128.225.34.22: Flags [.], ack 63664, win 898, options [nop,nop,TS val 2072449782 ecr 1197088857], length 0
00:20:48.150624 IP 162.243.188.66.41515 > 178.128.225.34.22: Flags [.], ack 65360, win 898, options [nop,nop,TS val 2072449783 ecr 1197088857], length 0
00:20:48.191065 IP 178.128.225.34.22 > 162.243.188.66.41515: Flags [P.], seq 66240:66448, ack 1, win 501, options [nop,nop,TS val 1197088912 ecr 2072449783], length 208
00:20:48.196199 IP 162.243.188.66.41515 > 178.128.225.34.22: Flags [.], ack 66448, win 898, options [nop,nop,TS val 2072449828 ecr 1197088857], length 0
00:20:48.205440 IP 162.243.188.66.41515 > 178.128.225.34.22: Flags [.], ack 66448, win 898, options [nop,nop,TS val 2072449837 ecr 1197088912,nop,nop,sack 1 {66240:66448}], length 0
00:20:48.239254 IP 178.128.225.34.22 > 162.243.188.66.41515: Flags [P.], seq 66448:66672, ack 1, win 501, options [nop,nop,TS val 1197088960 ecr 2072449837], length 224
00:20:48.239342 IP 178.128.225.34.22 > 162.243.188.66.41515: Flags [P.], seq 66672:67072, ack 1, win 501, options [nop,nop,TS val 1197088960 ecr 2072449837], length 400
00:20:48.239429 IP 178.128.225.34.22 > 162.243.188.66.41515: Flags [P.], seq 67072:67632, ack 1, win 501, options [nop,nop,TS val 1197088960 ecr 2072449837], length 560
00:20:48.239522 IP 178.128.225.34.22 > 162.243.188.66.41515: Flags [P.], seq 67632:68208, ack 1, win 501, options [nop,nop,TS val 1197088960 ecr 2072449837], length 576
00:20:48.239778 IP 178.128.225.34.22 > 162.243.188.66.41515: Flags [P.], seq 68208:70000, ack 1, win 501, options [nop,nop,TS val 1197088960 ecr 2072449837], length 1792
00:20:48.239829 IP 178.128.225.34.22 > 162.243.188.66.41515: Flags [P.], seq 70000:70384, ack 1, win 501, options [nop,nop,TS val 1197088960 ecr 2072449837], length 384
00:20:48.239877 IP 178.128.225.34.22 > 162.243.188.66.41515: Flags [P.], seq 70384:70624, ack 1, win 501, options [nop,nop,TS val 1197088960 ecr 2072449837], length 240
00:20:48.253730 IP 162.243.188.66.41515 > 178.128.225.34.22: Flags [.], ack 66672, win 898, options [nop,nop,TS val 2072449886 ecr 1197088960], length 0
00:20:48.253730 IP 162.243.188.66.41515 > 178.128.225.34.22: Flags [.], ack 67072, win 898, options [nop,nop,TS val 2072449886 ecr 1197088960], length 0
00:20:48.254186 IP 162.243.188.66.41515 > 178.128.225.34.22: Flags [.], ack 67632, win 898, options [nop,nop,TS val 2072449886 ecr 1197088960], length 0
00:20:48.254517 IP 162.243.188.66.41515 > 178.128.225.34.22: Flags [.], ack 68208, win 898, options [nop,nop,TS val 2072449886 ecr 1197088960], length 0
00:20:48.254548 IP 162.243.188.66.41515 > 178.128.225.34.22: Flags [.], ack 70000, win 898, options [nop,nop,TS val 2072449886 ecr 1197088960], length 0
00:20:48.254548 IP 162.243.188.66.41515 > 178.128.225.34.22: Flags [.], ack 70384, win 898, options [nop,nop,TS val 2072449886 ecr 1197088960], length 0
00:20:48.254548 IP 162.243.188.66.41515 > 178.128.225.34.22: Flags [.], ack 70624, win 898, options [nop,nop,TS val 2072449886 ecr 1197088960], length 0
00:20:48.343265 IP 178.128.225.34.22 > 162.243.188.66.41515: Flags [P.], seq 70624:70848, ack 1, win 501, options [nop,nop,TS val 1197089064 ecr 2072449886], length 224
00:20:48.343400 IP 178.128.225.34.22 > 162.243.188.66.41515: Flags [P.], seq 70848:71248, ack 1, win 501, options [nop,nop,TS val 1197089064 ecr 2072449886], length 400
00:20:48.343516 IP 178.128.225.34.22 > 162.243.188.66.41515: Flags [P.], seq 71248:71824, ack 1, win 501, options [nop,nop,TS val 1197089064 ecr 2072449886], length 576
00:20:48.343616 IP 178.128.225.34.22 > 162.243.188.66.41515: Flags [P.], seq 71824:72368, ack 1, win 501, options [nop,nop,TS val 1197089064 ecr 2072449886], length 544
00:20:48.343720 IP 178.128.225.34.22 > 162.243.188.66.41515: Flags [P.], seq 72368:72880, ack 1, win 501, options [nop,nop,TS val 1197089064 ecr 2072449886], length 512
00:20:48.343807 IP 178.128.225.34.22 > 162.243.188.66.41515: Flags [P.], seq 72880:73248, ack 1, win 501, options [nop,nop,TS val 1197089064 ecr 2072449886], length 368
00:20:48.357604 IP 162.243.188.66.41515 > 178.128.225.34.22: Flags [.], ack 70848, win 898, options [nop,nop,TS val 2072449990 ecr 1197089064], length 0
00:20:48.357604 IP 162.243.188.66.41515 > 178.128.225.34.22: Flags [.], ack 71248, win 898, options [nop,nop,TS val 2072449990 ecr 1197089064], length 0
00:20:48.357714 IP 162.243.188.66.41515 > 178.128.225.34.22: Flags [.], ack 71824, win 898, options [nop,nop,TS val 2072449990 ecr 1197089064], length 0
00:20:48.357801 IP 162.243.188.66.41515 > 178.128.225.34.22: Flags [.], ack 72368, win 898, options [nop,nop,TS val 2072449990 ecr 1197089064], length 0
00:20:48.357916 IP 162.243.188.66.41515 > 178.128.225.34.22: Flags [.], ack 72880, win 898, options [nop,nop,TS val 2072449990 ecr 1197089064], length 0
00:20:48.358102 IP 162.243.188.66.41515 > 178.128.225.34.22: Flags [.], ack 73248, win 898, options [nop,nop,TS val 2072449990 ecr 1197089064], length 0
00:20:48.447287 IP 178.128.225.34.22 > 162.243.188.66.41515: Flags [P.], seq 73248:73472, ack 1, win 501, options [nop,nop,TS val 1197089168 ecr 2072449990], length 224
00:20:48.447412 IP 178.128.225.34.22 > 162.243.188.66.41515: Flags [P.], seq 73472:73872, ack 1, win 501, options [nop,nop,TS val 1197089168 ecr 2072449990], length 400
00:20:48.447545 IP 178.128.225.34.22 > 162.243.188.66.41515: Flags [P.], seq 73872:74592, ack 1, win 501, options [nop,nop,TS val 1197089168 ecr 2072449990], length 720
00:20:48.447649 IP 178.128.225.34.22 > 162.243.188.66.41515: Flags [P.], seq 74592:75104, ack 1, win 501, options [nop,nop,TS val 1197089168 ecr 2072449990], length 512
00:20:48.447730 IP 178.128.225.34.22 > 162.243.188.66.41515: Flags [P.], seq 75104:75472, ack 1, win 501, options [nop,nop,TS val 1197089168 ecr 2072449990], length 368
00:20:48.447790 IP 178.128.225.34.22 > 162.243.188.66.41515: Flags [P.], seq 75472:75536, ack 1, win 501, options [nop,nop,TS val 1197089168 ecr 2072449990], length 64
00:20:48.461592 IP 162.243.188.66.41515 > 178.128.225.34.22: Flags [.], ack 73472, win 898, options [nop,nop,TS val 2072450094 ecr 1197089168], length 0
00:20:48.461646 IP 162.243.188.66.41515 > 178.128.225.34.22: Flags [.], ack 73872, win 898, options [nop,nop,TS val 2072450094 ecr 1197089168], length 0
00:20:48.461936 IP 162.243.188.66.41515 > 178.128.225.34.22: Flags [.], ack 75472, win 898, options [nop,nop,TS val 2072450094 ecr 1197089168], length 0
00:20:48.482807 IP 162.243.188.66.41515 > 178.128.225.34.22: Flags [.], ack 75536, win 898, options [nop,nop,TS val 2072450114 ecr 1197089168], length 0
00:20:48.551253 IP 178.128.225.34.22 > 162.243.188.66.41515: Flags [P.], seq 75536:75760, ack 1, win 501, options [nop,nop,TS val 1197089272 ecr 2072450114], length 224
00:20:48.551423 IP 178.128.225.34.22 > 162.243.188.66.41515: Flags [P.], seq 75760:76160, ack 1, win 501, options [nop,nop,TS val 1197089272 ecr 2072450114], length 400
00:20:48.551556 IP 178.128.225.34.22 > 162.243.188.66.41515: Flags [P.], seq 76160:76880, ack 1, win 501, options [nop,nop,TS val 1197089272 ecr 2072450114], length 720
00:20:48.551638 IP 178.128.225.34.22 > 162.243.188.66.41515: Flags [P.], seq 76880:77248, ack 1, win 501, options [nop,nop,TS val 1197089272 ecr 2072450114], length 368
00:20:48.551724 IP 178.128.225.34.22 > 162.243.188.66.41515: Flags [P.], seq 77248:77456, ack 1, win 501, options [nop,nop,TS val 1197089272 ecr 2072450114], length 208
00:20:48.566168 IP 162.243.188.66.41515 > 178.128.225.34.22: Flags [.], ack 77248, win 898, options [nop,nop,TS val 2072450198 ecr 1197089272], length 0
00:20:48.584170 IP 162.243.188.66.41515 > 178.128.225.34.22: Flags [.], ack 77456, win 898, options [nop,nop,TS val 2072450216 ecr 1197089272], length 0
00:20:48.655223 IP 178.128.225.34.22 > 162.243.188.66.41515: Flags [P.], seq 77456:77680, ack 1, win 501, options [nop,nop,TS val 1197089376 ecr 2072450216], length 224
00:20:48.655409 IP 178.128.225.34.22 > 162.243.188.66.41515: Flags [P.], seq 77680:78720, ack 1, win 501, options [nop,nop,TS val 1197089376 ecr 2072450216], length 1040
00:20:48.689218 IP 162.243.188.66.41515 > 178.128.225.34.22: Flags [.], ack 78720, win 898, options [nop,nop,TS val 2072450321 ecr 1197089376], length 0
00:20:48.759302 IP 178.128.225.34.22 > 162.243.188.66.41515: Flags [P.], seq 78720:78944, ack 1, win 501, options [nop,nop,TS val 1197089480 ecr 2072450321], length 224
00:20:48.759400 IP 178.128.225.34.22 > 162.243.188.66.41515: Flags [P.], seq 78944:79232, ack 1, win 501, options [nop,nop,TS val 1197089480 ecr 2072450321], length 288
00:20:48.759458 IP 178.128.225.34.22 > 162.243.188.66.41515: Flags [P.], seq 79232:79440, ack 1, win 501, options [nop,nop,TS val 1197089480 ecr 2072450321], length 208
00:20:48.759529 IP 178.128.225.34.22 > 162.243.188.66.41515: Flags [P.], seq 79440:79504, ack 1, win 501, options [nop,nop,TS val 1197089480 ecr 2072450321], length 64
00:20:48.777790 IP 162.243.188.66.41515 > 178.128.225.34.22: Flags [.], ack 79504, win 898, options [nop,nop,TS val 2072450410 ecr 1197089480], length 0
00:20:48.863241 IP 178.128.225.34.22 > 162.243.188.66.41515: Flags [P.], seq 79504:79728, ack 1, win 501, options [nop,nop,TS val 1197089584 ecr 2072450410], length 224
00:20:48.863365 IP 178.128.225.34.22 > 162.243.188.66.41515: Flags [P.], seq 79728:79952, ack 1, win 501, options [nop,nop,TS val 1197089584 ecr 2072450410], length 224
00:20:48.863422 IP 178.128.225.34.22 > 162.243.188.66.41515: Flags [P.], seq 79952:80176, ack 1, win 501, options [nop,nop,TS val 1197089584 ecr 2072450410], length 224
00:20:48.863467 IP 178.128.225.34.22 > 162.243.188.66.41515: Flags [P.], seq 80176:80560, ack 1, win 501, options [nop,nop,TS val 1197089584 ecr 2072450410], length 384
00:20:48.863526 IP 178.128.225.34.22 > 162.243.188.66.41515: Flags [P.], seq 80560:80624, ack 1, win 501, options [nop,nop,TS val 1197089584 ecr 2072450410], length 64
00:20:48.905117 IP 162.243.188.66.41515 > 178.128.225.34.22: Flags [.], ack 80624, win 898, options [nop,nop,TS val 2072450537 ecr 1197089584], length 0
00:20:48.967303 IP 178.128.225.34.22 > 162.243.188.66.41515: Flags [P.], seq 80624:80848, ack 1, win 501, options [nop,nop,TS val 1197089688 ecr 2072450537], length 224
00:20:48.967515 IP 178.128.225.34.22 > 162.243.188.66.41515: Flags [P.], seq 80848:81584, ack 1, win 501, options [nop,nop,TS val 1197089688 ecr 2072450537], length 736
00:20:48.967690 IP 178.128.225.34.22 > 162.243.188.66.41515: Flags [P.], seq 81584:81792, ack 1, win 501, options [nop,nop,TS val 1197089688 ecr 2072450537], length 208
00:20:48.994740 IP 162.243.188.66.41515 > 178.128.225.34.22: Flags [.], ack 81792, win 898, options [nop,nop,TS val 2072450627 ecr 1197089688], length 0
00:20:49.011391 IP 218.92.0.102.49430 > 178.128.225.34.22: Flags [S], seq 758586131, win 29200, options [mss 1460,sackOK,TS val 18493553 ecr 0,nop,wscale 7], length 0
00:20:49.011459 IP 178.128.225.34.22 > 218.92.0.102.49430: Flags [S.], seq 2285326933, ack 758586132, win 65160, options [mss 1460,sackOK,TS val 2236148178 ecr 18493553,nop,wscale 7], length 0
00:20:49.035065 IP 178.128.225.34.22 > 218.92.0.102.10136: Flags [S.], seq 249639587, ack 3258133593, win 65160, options [mss 1460,sackOK,TS val 2236148202 ecr 18492302,nop,wscale 7], length 0
00:20:49.071211 IP 178.128.225.34.22 > 162.243.188.66.41515: Flags [P.], seq 81792:82016, ack 1, win 501, options [nop,nop,TS val 1197089792 ecr 2072450627], length 224
00:20:49.071417 IP 178.128.225.34.22 > 162.243.188.66.41515: Flags [P.], seq 82016:83120, ack 1, win 501, options [nop,nop,TS val 1197089792 ecr 2072450627], length 1104
00:20:49.071474 IP 178.128.225.34.22 > 162.243.188.66.41515: Flags [P.], seq 83120:83184, ack 1, win 501, options [nop,nop,TS val 1197089792 ecr 2072450627], length 64
00:20:49.093499 IP 162.243.188.66.41515 > 178.128.225.34.22: Flags [.], ack 83184, win 898, options [nop,nop,TS val 2072450725 ecr 1197089792], length 0
00:20:49.175251 IP 178.128.225.34.22 > 162.243.188.66.41515: Flags [P.], seq 83184:83408, ack 1, win 501, options [nop,nop,TS val 1197089896 ecr 2072450725], length 224
00:20:49.175371 IP 178.128.225.34.22 > 162.243.188.66.41515: Flags [P.], seq 83408:83952, ack 1, win 501, options [nop,nop,TS val 1197089896 ecr 2072450725], length 544
00:20:49.175436 IP 178.128.225.34.22 > 162.243.188.66.41515: Flags [P.], seq 83952:84016, ack 1, win 501, options [nop,nop,TS val 1197089896 ecr 2072450725], length 64
00:20:49.202576 IP 162.243.188.66.41515 > 178.128.225.34.22: Flags [.], ack 84016, win 898, options [nop,nop,TS val 2072450835 ecr 1197089896], length 0
00:20:49.279330 IP 178.128.225.34.22 > 162.243.188.66.41515: Flags [P.], seq 84016:84240, ack 1, win 501, options [nop,nop,TS val 1197090000 ecr 2072450835], length 224
00:20:49.279485 IP 178.128.225.34.22 > 162.243.188.66.41515: Flags [P.], seq 84240:84640, ack 1, win 501, options [nop,nop,TS val 1197090000 ecr 2072450835], length 400
00:20:49.279768 IP 178.128.225.34.22 > 162.243.188.66.41515: Flags [P.], seq 84640:84848, ack 1, win 501, options [nop,nop,TS val 1197090000 ecr 2072450835], length 208
00:20:49.298922 IP 162.243.188.66.41515 > 178.128.225.34.22: Flags [.], ack 84848, win 898, options [nop,nop,TS val 2072450931 ecr 1197090000], length 0
00:20:49.383229 IP 178.128.225.34.22 > 162.243.188.66.41515: Flags [P.], seq 84848:85072, ack 1, win 501, options [nop,nop,TS val 1197090104 ecr 2072450931], length 224
00:20:49.383344 IP 178.128.225.34.22 > 162.243.188.66.41515: Flags [P.], seq 85072:85632, ack 1, win 501, options [nop,nop,TS val 1197090104 ecr 2072450931], length 560
00:20:49.402414 IP 162.243.188.66.41515 > 178.128.225.34.22: Flags [.], ack 85632, win 898, options [nop,nop,TS val 2072451034 ecr 1197090104], length 0
00:20:49.487254 IP 178.128.225.34.22 > 162.243.188.66.41515: Flags [P.], seq 85632:85856, ack 1, win 501, options [nop,nop,TS val 1197090208 ecr 2072451034], length 224
00:20:49.487364 IP 178.128.225.34.22 > 162.243.188.66.41515: Flags [P.], seq 85856:86240, ack 1, win 501, options [nop,nop,TS val 1197090208 ecr 2072451034], length 384
00:20:49.505634 IP 162.243.188.66.41515 > 178.128.225.34.22: Flags [.], ack 86240, win 898, options [nop,nop,TS val 2072451138 ecr 1197090208], length 0
00:20:49.591257 IP 178.128.225.34.22 > 162.243.188.66.41515: Flags [P.], seq 86240:86464, ack 1, win 501, options [nop,nop,TS val 1197090312 ecr 2072451138], length 224
00:20:49.591511 IP 178.128.225.34.22 > 162.243.188.66.41515: Flags [P.], seq 86464:86848, ack 1, win 501, options [nop,nop,TS val 1197090312 ecr 2072451138], length 384
00:20:49.616834 IP 162.243.188.66.41515 > 178.128.225.34.22: Flags [.], ack 86848, win 898, options [nop,nop,TS val 2072451249 ecr 1197090312], length 0
00:20:49.695274 IP 178.128.225.34.22 > 162.243.188.66.41515: Flags [P.], seq 86848:87392, ack 1, win 501, options [nop,nop,TS val 1197090416 ecr 2072451249], length 544
00:20:49.715437 IP 162.243.188.66.41515 > 178.128.225.34.22: Flags [.], ack 87392, win 898, options [nop,nop,TS val 2072451347 ecr 1197090416], length 0
00:20:49.799273 IP 178.128.225.34.22 > 162.243.188.66.41515: Flags [P.], seq 87392:87776, ack 1, win 501, options [nop,nop,TS val 1197090520 ecr 2072451347], length 384
00:20:49.822929 IP 162.243.188.66.41515 > 178.128.225.34.22: Flags [.], ack 87776, win 898, options [nop,nop,TS val 2072451455 ecr 1197090520], length 0
00:20:49.903294 IP 178.128.225.34.22 > 162.243.188.66.41515: Flags [P.], seq 87776:88160, ack 1, win 501, options [nop,nop,TS val 1197090624 ecr 2072451455], length 384
00:20:49.926417 IP 162.243.188.66.41515 > 178.128.225.34.22: Flags [.], ack 88160, win 898, options [nop,nop,TS val 2072451558 ecr 1197090624], length 0
00:20:50.006539 IP 218.92.0.102.49430 > 178.128.225.34.22: Flags [S], seq 758586131, win 29200, options [mss 1460,sackOK,TS val 18493803 ecr 0,nop,wscale 7], length 0
00:20:50.006608 IP 178.128.225.34.22 > 218.92.0.102.49430: Flags [S.], seq 2285326933, ack 758586132, win 65160, options [mss 1460,sackOK,TS val 2236149173 ecr 18493553,nop,wscale 7], length 0
00:20:50.007261 IP 178.128.225.34.22 > 162.243.188.66.41515: Flags [P.], seq 88160:88896, ack 1, win 501, options [nop,nop,TS val 1197090728 ecr 2072451558], length 736
00:20:50.025998 IP 162.243.188.66.41515 > 178.128.225.34.22: Flags [.], ack 88896, win 898, options [nop,nop,TS val 2072451658 ecr 1197090728], length 0
00:20:50.111281 IP 178.128.225.34.22 > 162.243.188.66.41515: Flags [P.], seq 88896:89280, ack 1, win 501, options [nop,nop,TS val 1197090832 ecr 2072451658], length 384
00:20:50.128672 IP 162.243.188.66.41515 > 178.128.225.34.22: Flags [.], ack 89280, win 898, options [nop,nop,TS val 2072451761 ecr 1197090832], length 0
00:20:50.215283 IP 178.128.225.34.22 > 162.243.188.66.41515: Flags [P.], seq 89280:89664, ack 1, win 501, options [nop,nop,TS val 1197090936 ecr 2072451761], length 384
00:20:50.236704 IP 162.243.188.66.41515 > 178.128.225.34.22: Flags [.], ack 89664, win 898, options [nop,nop,TS val 2072451869 ecr 1197090936], length 0
00:20:50.319385 IP 178.128.225.34.22 > 162.243.188.66.41515: Flags [P.], seq 89664:90048, ack 1, win 501, options [nop,nop,TS val 1197091040 ecr 2072451869], length 384
00:20:50.335264 IP 162.243.188.66.41515 > 178.128.225.34.22: Flags [.], ack 90048, win 898, options [nop,nop,TS val 2072451967 ecr 1197091040], length 0
00:20:50.423245 IP 178.128.225.34.22 > 162.243.188.66.41515: Flags [P.], seq 90048:90432, ack 1, win 501, options [nop,nop,TS val 1197091144 ecr 2072451967], length 384
00:20:50.445513 IP 162.243.188.66.41515 > 178.128.225.34.22: Flags [.], ack 90432, win 898, options [nop,nop,TS val 2072452077 ecr 1197091144], length 0
00:20:50.527255 IP 178.128.225.34.22 > 162.243.188.66.41515: Flags [P.], seq 90432:90816, ack 1, win 501, options [nop,nop,TS val 1197091248 ecr 2072452077], length 384
00:20:50.545098 IP 162.243.188.66.41515 > 178.128.225.34.22: Flags [.], ack 90816, win 898, options [nop,nop,TS val 2072452176 ecr 1197091248], length 0
00:20:50.631278 IP 178.128.225.34.22 > 162.243.188.66.41515: Flags [P.], seq 90816:91200, ack 1, win 501, options [nop,nop,TS val 1197091352 ecr 2072452176], length 384
00:20:50.648543 IP 162.243.188.66.41515 > 178.128.225.34.22: Flags [.], ack 91200, win 898, options [nop,nop,TS val 2072452280 ecr 1197091352], length 0
00:20:50.735259 IP 178.128.225.34.22 > 162.243.188.66.41515: Flags [P.], seq 91200:91584, ack 1, win 501, options [nop,nop,TS val 1197091456 ecr 2072452280], length 384
00:20:50.752499 IP 162.243.188.66.41515 > 178.128.225.34.22: Flags [.], ack 91584, win 898, options [nop,nop,TS val 2072452384 ecr 1197091456], length 0
00:20:50.839340 IP 178.128.225.34.22 > 162.243.188.66.41515: Flags [P.], seq 91584:91968, ack 1, win 501, options [nop,nop,TS val 1197091560 ecr 2072452384], length 384
00:20:50.856279 IP 162.243.188.66.41515 > 178.128.225.34.22: Flags [.], ack 91968, win 898, options [nop,nop,TS val 2072452488 ecr 1197091560], length 0
00:20:50.943229 IP 178.128.225.34.22 > 162.243.188.66.41515: Flags [P.], seq 91968:92352, ack 1, win 501, options [nop,nop,TS val 1197091664 ecr 2072452488], length 384
00:20:50.961152 IP 162.243.188.66.41515 > 178.128.225.34.22: Flags [.], ack 92352, win 898, options [nop,nop,TS val 2072452593 ecr 1197091664], length 0
00:20:51.019077 IP 178.128.225.34.22 > 218.92.0.102.49430: Flags [S.], seq 2285326933, ack 758586132, win 65160, options [mss 1460,sackOK,TS val 2236150186 ecr 18493553,nop,wscale 7], length 0
00:20:51.047258 IP 178.128.225.34.22 > 162.243.188.66.41515: Flags [P.], seq 92352:92928, ack 1, win 501, options [nop,nop,TS val 1197091768 ecr 2072452593], length 576
00:20:51.065186 IP 162.243.188.66.41515 > 178.128.225.34.22: Flags [.], ack 92928, win 898, options [nop,nop,TS val 2072452697 ecr 1197091768], length 0
00:20:51.151213 IP 178.128.225.34.22 > 162.243.188.66.41515: Flags [P.], seq 92928:93312, ack 1, win 501, options [nop,nop,TS val 1197091872 ecr 2072452697], length 384
00:20:51.167846 IP 162.243.188.66.41515 > 178.128.225.34.22: Flags [.], ack 93312, win 898, options [nop,nop,TS val 2072452800 ecr 1197091872], length 0
00:20:51.255450 IP 178.128.225.34.22 > 162.243.188.66.41515: Flags [P.], seq 93312:93696, ack 1, win 501, options [nop,nop,TS val 1197091976 ecr 2072452800], length 384
00:20:51.272489 IP 162.243.188.66.41515 > 178.128.225.34.22: Flags [.], ack 93696, win 898, options [nop,nop,TS val 2072452904 ecr 1197091976], length 0
00:20:51.359289 IP 178.128.225.34.22 > 162.243.188.66.41515: Flags [P.], seq 93696:94080, ack 1, win 501, options [nop,nop,TS val 1197092080 ecr 2072452904], length 384
00:20:51.385218 IP 162.243.188.66.41515 > 178.128.225.34.22: Flags [.], ack 94080, win 898, options [nop,nop,TS val 2072453017 ecr 1197092080], length 0
00:20:51.463246 IP 178.128.225.34.22 > 162.243.188.66.41515: Flags [P.], seq 94080:94464, ack 1, win 501, options [nop,nop,TS val 1197092184 ecr 2072453017], length 384
00:20:51.481513 IP 162.243.188.66.41515 > 178.128.225.34.22: Flags [.], ack 94464, win 898, options [nop,nop,TS val 2072453114 ecr 1197092184], length 0
00:20:51.567297 IP 178.128.225.34.22 > 162.243.188.66.41515: Flags [P.], seq 94464:94848, ack 1, win 501, options [nop,nop,TS val 1197092288 ecr 2072453114], length 384
00:20:51.589699 IP 162.243.188.66.41515 > 178.128.225.34.22: Flags [.], ack 94848, win 898, options [nop,nop,TS val 2072453222 ecr 1197092288], length 0
00:20:51.671260 IP 178.128.225.34.22 > 162.243.188.66.41515: Flags [P.], seq 94848:95232, ack 1, win 501, options [nop,nop,TS val 1197092392 ecr 2072453222], length 384
00:20:51.688102 IP 162.243.188.66.41515 > 178.128.225.34.22: Flags [.], ack 95232, win 898, options [nop,nop,TS val 2072453320 ecr 1197092392], length 0
00:20:51.775333 IP 178.128.225.34.22 > 162.243.188.66.41515: Flags [P.], seq 95232:95616, ack 1, win 501, options [nop,nop,TS val 1197092496 ecr 2072453320], length 384
00:20:51.795990 IP 162.243.188.66.41515 > 178.128.225.34.22: Flags [.], ack 95616, win 898, options [nop,nop,TS val 2072453428 ecr 1197092496], length 0
00:20:51.879265 IP 178.128.225.34.22 > 162.243.188.66.41515: Flags [P.], seq 95616:96000, ack 1, win 501, options [nop,nop,TS val 1197092600 ecr 2072453428], length 384
00:20:51.897201 IP 162.243.188.66.41515 > 178.128.225.34.22: Flags [.], ack 96000, win 898, options [nop,nop,TS val 2072453529 ecr 1197092600], length 0
00:20:51.983448 IP 178.128.225.34.22 > 162.243.188.66.41515: Flags [P.], seq 96000:96384, ack 1, win 501, options [nop,nop,TS val 1197092704 ecr 2072453529], length 384
00:20:52.002650 IP 162.243.188.66.41515 > 178.128.225.34.22: Flags [.], ack 96384, win 898, options [nop,nop,TS val 2072453634 ecr 1197092704], length 0
00:20:52.010321 IP 218.92.0.102.49430 > 178.128.225.34.22: Flags [S], seq 758586131, win 29200, options [mss 1460,sackOK,TS val 18494304 ecr 0,nop,wscale 7], length 0
00:20:52.010390 IP 178.128.225.34.22 > 218.92.0.102.49430: Flags [S.], seq 2285326933, ack 758586132, win 65160, options [mss 1460,sackOK,TS val 2236151177 ecr 18493553,nop,wscale 7], length 0
00:20:52.087288 IP 178.128.225.34.22 > 162.243.188.66.41515: Flags [P.], seq 96384:97120, ack 1, win 501, options [nop,nop,TS val 1197092808 ecr 2072453634], length 736
00:20:52.108058 IP 162.243.188.66.41515 > 178.128.225.34.22: Flags [.], ack 97120, win 898, options [nop,nop,TS val 2072453740 ecr 1197092808], length 0
00:20:52.191286 IP 178.128.225.34.22 > 162.243.188.66.41515: Flags [P.], seq 97120:97504, ack 1, win 501, options [nop,nop,TS val 1197092912 ecr 2072453740], length 384
00:20:52.209042 IP 162.243.188.66.41515 > 178.128.225.34.22: Flags [.], ack 97504, win 898, options [nop,nop,TS val 2072453841 ecr 1197092912], length 0
00:20:52.295216 IP 178.128.225.34.22 > 162.243.188.66.41515: Flags [P.], seq 97504:97888, ack 1, win 501, options [nop,nop,TS val 1197093016 ecr 2072453841], length 384
00:20:52.313260 IP 162.243.188.66.41515 > 178.128.225.34.22: Flags [.], ack 97888, win 898, options [nop,nop,TS val 2072453945 ecr 1197093016], length 0
00:20:52.399408 IP 178.128.225.34.22 > 162.243.188.66.41515: Flags [P.], seq 97888:98272, ack 1, win 501, options [nop,nop,TS val 1197093120 ecr 2072453945], length 384
00:20:52.421803 IP 162.243.188.66.41515 > 178.128.225.34.22: Flags [.], ack 98272, win 898, options [nop,nop,TS val 2072454054 ecr 1197093120], length 0
00:20:52.503335 IP 178.128.225.34.22 > 162.243.188.66.41515: Flags [P.], seq 98272:98656, ack 1, win 501, options [nop,nop,TS val 1197093224 ecr 2072454054], length 384
00:20:52.521872 IP 162.243.188.66.41515 > 178.128.225.34.22: Flags [.], ack 98656, win 898, options [nop,nop,TS val 2072454154 ecr 1197093224], length 0
00:20:52.607258 IP 178.128.225.34.22 > 162.243.188.66.41515: Flags [P.], seq 98656:99040, ack 1, win 501, options [nop,nop,TS val 1197093328 ecr 2072454154], length 384
00:20:52.626050 IP 162.243.188.66.41515 > 178.128.225.34.22: Flags [.], ack 99040, win 898, options [nop,nop,TS val 2072454257 ecr 1197093328], length 0
00:20:52.711246 IP 178.128.225.34.22 > 162.243.188.66.41515: Flags [P.], seq 99040:99424, ack 1, win 501, options [nop,nop,TS val 1197093432 ecr 2072454257], length 384
00:20:52.727743 IP 162.243.188.66.41515 > 178.128.225.34.22: Flags [.], ack 99424, win 898, options [nop,nop,TS val 2072454360 ecr 1197093432], length 0
00:20:52.815275 IP 178.128.225.34.22 > 162.243.188.66.41515: Flags [P.], seq 99424:99808, ack 1, win 501, options [nop,nop,TS val 1197093536 ecr 2072454360], length 384
00:20:52.831490 IP 162.243.188.66.41515 > 178.128.225.34.22: Flags [.], ack 99808, win 898, options [nop,nop,TS val 2072454463 ecr 1197093536], length 0
00:20:52.919310 IP 178.128.225.34.22 > 162.243.188.66.41515: Flags [P.], seq 99808:100192, ack 1, win 501, options [nop,nop,TS val 1197093640 ecr 2072454463], length 384
00:20:52.936691 IP 162.243.188.66.41515 > 178.128.225.34.22: Flags [.], ack 100192, win 898, options [nop,nop,TS val 2072454569 ecr 1197093640], length 0
00:20:53.023275 IP 178.128.225.34.22 > 162.243.188.66.41515: Flags [P.], seq 100192:100576, ack 1, win 501, options [nop,nop,TS val 1197093744 ecr 2072454569], length 384
00:20:53.043082 IP 162.243.188.66.41515 > 178.128.225.34.22: Flags [.], ack 100576, win 898, options [nop,nop,TS val 2072454675 ecr 1197093744], length 0
00:20:53.067037 IP 178.128.225.34.22 > 218.92.0.102.10136: Flags [S.], seq 249639587, ack 3258133593, win 65160, options [mss 1460,sackOK,TS val 2236152234 ecr 18492302,nop,wscale 7], length 0
00:20:53.127259 IP 178.128.225.34.22 > 162.243.188.66.41515: Flags [P.], seq 100576:101152, ack 1, win 501, options [nop,nop,TS val 1197093848 ecr 2072454675], length 576
00:20:53.150436 IP 162.243.188.66.41515 > 178.128.225.34.22: Flags [.], ack 101152, win 898, options [nop,nop,TS val 2072454782 ecr 1197093848], length 0
00:20:53.231306 IP 178.128.225.34.22 > 162.243.188.66.41515: Flags [P.], seq 101152:101536, ack 1, win 501, options [nop,nop,TS val 1197093952 ecr 2072454782], length 384
00:20:53.248070 IP 162.243.188.66.41515 > 178.128.225.34.22: Flags [.], ack 101536, win 898, options [nop,nop,TS val 2072454880 ecr 1197093952], length 0
00:20:53.335324 IP 178.128.225.34.22 > 162.243.188.66.41515: Flags [P.], seq 101536:101920, ack 1, win 501, options [nop,nop,TS val 1197094056 ecr 2072454880], length 384
00:20:53.352085 IP 162.243.188.66.41515 > 178.128.225.34.22: Flags [.], ack 101920, win 898, options [nop,nop,TS val 2072454984 ecr 1197094056], length 0
00:20:53.439246 IP 178.128.225.34.22 > 162.243.188.66.41515: Flags [P.], seq 101920:102304, ack 1, win 501, options [nop,nop,TS val 1197094160 ecr 2072454984], length 384
00:20:53.456941 IP 162.243.188.66.41515 > 178.128.225.34.22: Flags [.], ack 102304, win 898, options [nop,nop,TS val 2072455089 ecr 1197094160], length 0
00:20:53.543333 IP 178.128.225.34.22 > 162.243.188.66.41515: Flags [P.], seq 102304:102688, ack 1, win 501, options [nop,nop,TS val 1197094264 ecr 2072455089], length 384
00:20:53.560050 IP 162.243.188.66.41515 > 178.128.225.34.22: Flags [.], ack 102688, win 898, options [nop,nop,TS val 2072455192 ecr 1197094264], length 0
00:20:53.647281 IP 178.128.225.34.22 > 162.243.188.66.41515: Flags [P.], seq 102688:103072, ack 1, win 501, options [nop,nop,TS val 1197094368 ecr 2072455192], length 384
00:20:53.665334 IP 162.243.188.66.41515 > 178.128.225.34.22: Flags [.], ack 103072, win 898, options [nop,nop,TS val 2072455297 ecr 1197094368], length 0
00:20:53.751414 IP 178.128.225.34.22 > 162.243.188.66.41515: Flags [P.], seq 103072:103456, ack 1, win 501, options [nop,nop,TS val 1197094472 ecr 2072455297], length 384
00:20:53.768140 IP 162.243.188.66.41515 > 178.128.225.34.22: Flags [.], ack 103456, win 898, options [nop,nop,TS val 2072455400 ecr 1197094472], length 0
00:20:53.855302 IP 178.128.225.34.22 > 162.243.188.66.41515: Flags [P.], seq 103456:103840, ack 1, win 501, options [nop,nop,TS val 1197094576 ecr 2072455400], length 384
00:20:53.872542 IP 162.243.188.66.41515 > 178.128.225.34.22: Flags [.], ack 103840, win 898, options [nop,nop,TS val 2072455505 ecr 1197094576], length 0
00:20:53.959284 IP 178.128.225.34.22 > 162.243.188.66.41515: Flags [P.], seq 103840:104224, ack 1, win 501, options [nop,nop,TS val 1197094680 ecr 2072455505], length 384
00:20:53.975743 IP 162.243.188.66.41515 > 178.128.225.34.22: Flags [.], ack 104224, win 898, options [nop,nop,TS val 2072455608 ecr 1197094680], length 0
00:20:54.007770 IP 218.92.0.102.33655 > 178.128.225.34.22: Flags [S], seq 2278726906, win 29200, options [mss 1460,sackOK,TS val 18494804 ecr 0,nop,wscale 7], length 0
00:20:54.007853 IP 178.128.225.34.22 > 218.92.0.102.33655: Flags [S.], seq 3611222848, ack 2278726907, win 65160, options [mss 1460,sackOK,TS val 2236153174 ecr 18494804,nop,wscale 7], length 0
00:20:54.027078 IP 178.128.225.34.22 > 218.92.0.102.49430: Flags [S.], seq 2285326933, ack 758586132, win 65160, options [mss 1460,sackOK,TS val 2236153194 ecr 18493553,nop,wscale 7], length 0
00:20:54.063492 IP 178.128.225.34.22 > 162.243.188.66.41515: Flags [P.], seq 104224:105168, ack 1, win 501, options [nop,nop,TS val 1197094784 ecr 2072455608], length 944
00:20:54.093593 IP 162.243.188.66.41515 > 178.128.225.34.22: Flags [.], ack 105168, win 898, options [nop,nop,TS val 2072455726 ecr 1197094784], length 0
00:20:54.167275 IP 178.128.225.34.22 > 162.243.188.66.41515: Flags [P.], seq 105168:105552, ack 1, win 501, options [nop,nop,TS val 1197094888 ecr 2072455726], length 384
00:20:54.183760 IP 162.243.188.66.41515 > 178.128.225.34.22: Flags [.], ack 105552, win 898, options [nop,nop,TS val 2072455816 ecr 1197094888], length 0
00:20:54.271257 IP 178.128.225.34.22 > 162.243.188.66.41515: Flags [P.], seq 105552:105936, ack 1, win 501, options [nop,nop,TS val 1197094992 ecr 2072455816], length 384
00:20:54.290622 IP 162.243.188.66.41515 > 178.128.225.34.22: Flags [.], ack 105936, win 898, options [nop,nop,TS val 2072455923 ecr 1197094992], length 0
00:20:54.375349 IP 178.128.225.34.22 > 162.243.188.66.41515: Flags [P.], seq 105936:106320, ack 1, win 501, options [nop,nop,TS val 1197095096 ecr 2072455923], length 384
00:20:54.393224 IP 162.243.188.66.41515 > 178.128.225.34.22: Flags [.], ack 106320, win 898, options [nop,nop,TS val 2072456025 ecr 1197095096], length 0
00:20:54.479340 IP 178.128.225.34.22 > 162.243.188.66.41515: Flags [P.], seq 106320:106704, ack 1, win 501, options [nop,nop,TS val 1197095200 ecr 2072456025], length 384
00:20:54.499987 IP 162.243.188.66.41515 > 178.128.225.34.22: Flags [.], ack 106704, win 898, options [nop,nop,TS val 2072456132 ecr 1197095200], length 0
00:20:54.583255 IP 178.128.225.34.22 > 162.243.188.66.41515: Flags [P.], seq 106704:107088, ack 1, win 501, options [nop,nop,TS val 1197095304 ecr 2072456132], length 384
00:20:54.604293 IP 162.243.188.66.41515 > 178.128.225.34.22: Flags [.], ack 107088, win 898, options [nop,nop,TS val 2072456236 ecr 1197095304], length 0
00:20:54.687266 IP 178.128.225.34.22 > 162.243.188.66.41515: Flags [P.], seq 107088:107472, ack 1, win 501, options [nop,nop,TS val 1197095408 ecr 2072456236], length 384
00:20:54.707256 IP 162.243.188.66.41515 > 178.128.225.34.22: Flags [.], ack 107472, win 898, options [nop,nop,TS val 2072456339 ecr 1197095408], length 0
00:20:54.791343 IP 178.128.225.34.22 > 162.243.188.66.41515: Flags [P.], seq 107472:107856, ack 1, win 501, options [nop,nop,TS val 1197095512 ecr 2072456339], length 384
00:20:54.807942 IP 162.243.188.66.41515 > 178.128.225.34.22: Flags [.], ack 107856, win 898, options [nop,nop,TS val 2072456440 ecr 1197095512], length 0
00:20:54.895237 IP 178.128.225.34.22 > 162.243.188.66.41515: Flags [P.], seq 107856:108240, ack 1, win 501, options [nop,nop,TS val 1197095616 ecr 2072456440], length 384
00:20:54.914809 IP 162.243.188.66.41515 > 178.128.225.34.22: Flags [.], ack 108240, win 898, options [nop,nop,TS val 2072456547 ecr 1197095616], length 0
00:20:54.999335 IP 178.128.225.34.22 > 162.243.188.66.41515: Flags [P.], seq 108240:108624, ack 1, win 501, options [nop,nop,TS val 1197095720 ecr 2072456547], length 384
00:20:55.007342 IP 218.92.0.102.33655 > 178.128.225.34.22: Flags [S], seq 2278726906, win 29200, options [mss 1460,sackOK,TS val 18495054 ecr 0,nop,wscale 7], length 0
00:20:55.007406 IP 178.128.225.34.22 > 218.92.0.102.33655: Flags [S.], seq 3611222848, ack 2278726907, win 65160, options [mss 1460,sackOK,TS val 2236154174 ecr 18494804,nop,wscale 7], length 0
00:20:55.019732 IP 162.243.188.66.41515 > 178.128.225.34.22: Flags [.], ack 108624, win 898, options [nop,nop,TS val 2072456652 ecr 1197095720], length 0
00:20:55.103319 IP 178.128.225.34.22 > 162.243.188.66.41515: Flags [P.], seq 108624:109376, ack 1, win 501, options [nop,nop,TS val 1197095824 ecr 2072456652], length 752
00:20:55.123594 IP 162.243.188.66.41515 > 178.128.225.34.22: Flags [.], ack 109376, win 898, options [nop,nop,TS val 2072456755 ecr 1197095824], length 0
00:20:55.207328 IP 178.128.225.34.22 > 162.243.188.66.41515: Flags [P.], seq 109376:109760, ack 1, win 501, options [nop,nop,TS val 1197095928 ecr 2072456755], length 384
00:20:55.224360 IP 162.243.188.66.41515 > 178.128.225.34.22: Flags [.], ack 109760, win 898, options [nop,nop,TS val 2072456856 ecr 1197095928], length 0
00:20:55.311243 IP 178.128.225.34.22 > 162.243.188.66.41515: Flags [P.], seq 109760:110144, ack 1, win 501, options [nop,nop,TS val 1197096032 ecr 2072456856], length 384
00:20:55.327611 IP 162.243.188.66.41515 > 178.128.225.34.22: Flags [.], ack 110144, win 898, options [nop,nop,TS val 2072456960 ecr 1197096032], length 0
00:20:55.415280 IP 178.128.225.34.22 > 162.243.188.66.41515: Flags [P.], seq 110144:110528, ack 1, win 501, options [nop,nop,TS val 1197096136 ecr 2072456960], length 384
00:20:55.434528 IP 162.243.188.66.41515 > 178.128.225.34.22: Flags [.], ack 110528, win 898, options [nop,nop,TS val 2072457067 ecr 1197096136], length 0
00:20:55.519276 IP 178.128.225.34.22 > 162.243.188.66.41515: Flags [P.], seq 110528:110912, ack 1, win 501, options [nop,nop,TS val 1197096240 ecr 2072457067], length 384
00:20:55.540243 IP 162.243.188.66.41515 > 178.128.225.34.22: Flags [.], ack 110912, win 898, options [nop,nop,TS val 2072457172 ecr 1197096240], length 0
00:20:55.623342 IP 178.128.225.34.22 > 162.243.188.66.41515: Flags [P.], seq 110912:111296, ack 1, win 501, options [nop,nop,TS val 1197096344 ecr 2072457172], length 384
00:20:55.645327 IP 162.243.188.66.41515 > 178.128.225.34.22: Flags [.], ack 111296, win 898, options [nop,nop,TS val 2072457277 ecr 1197096344], length 0
00:20:55.727272 IP 178.128.225.34.22 > 162.243.188.66.41515: Flags [P.], seq 111296:111680, ack 1, win 501, options [nop,nop,TS val 1197096448 ecr 2072457277], length 384
00:20:55.746789 IP 162.243.188.66.41515 > 178.128.225.34.22: Flags [.], ack 111680, win 898, options [nop,nop,TS val 2072457379 ecr 1197096448], length 0
00:20:55.831271 IP 178.128.225.34.22 > 162.243.188.66.41515: Flags [P.], seq 111680:112064, ack 1, win 501, options [nop,nop,TS val 1197096552 ecr 2072457379], length 384
00:20:55.848996 IP 162.243.188.66.41515 > 178.128.225.34.22: Flags [.], ack 112064, win 898, options [nop,nop,TS val 2072457481 ecr 1197096552], length 0
00:20:55.935330 IP 178.128.225.34.22 > 162.243.188.66.41515: Flags [P.], seq 112064:112448, ack 1, win 501, options [nop,nop,TS val 1197096656 ecr 2072457481], length 384
00:20:55.956880 IP 162.243.188.66.41515 > 178.128.225.34.22: Flags [.], ack 112448, win 898, options [nop,nop,TS val 2072457589 ecr 1197096656], length 0
00:20:56.011055 IP 178.128.225.34.22 > 218.92.0.102.33655: Flags [S.], seq 3611222848, ack 2278726907, win 65160, options [mss 1460,sackOK,TS val 2236155178 ecr 18494804,nop,wscale 7], length 0
00:20:56.039292 IP 178.128.225.34.22 > 162.243.188.66.41515: Flags [P.], seq 112448:113024, ack 1, win 501, options [nop,nop,TS val 1197096760 ecr 2072457589], length 576
00:20:56.058895 IP 162.243.188.66.41515 > 178.128.225.34.22: Flags [.], ack 113024, win 898, options [nop,nop,TS val 2072457690 ecr 1197096760], length 0
00:20:56.143322 IP 178.128.225.34.22 > 162.243.188.66.41515: Flags [P.], seq 113024:113408, ack 1, win 501, options [nop,nop,TS val 1197096864 ecr 2072457690], length 384
00:20:56.162635 IP 162.243.188.66.41515 > 178.128.225.34.22: Flags [.], ack 113408, win 898, options [nop,nop,TS val 2072457795 ecr 1197096864], length 0
00:20:56.247482 IP 178.128.225.34.22 > 162.243.188.66.41515: Flags [P.], seq 113408:113792, ack 1, win 501, options [nop,nop,TS val 1197096968 ecr 2072457795], length 384
00:20:56.268088 IP 162.243.188.66.41515 > 178.128.225.34.22: Flags [.], ack 113792, win 898, options [nop,nop,TS val 2072457900 ecr 1197096968], length 0
00:20:56.351266 IP 178.128.225.34.22 > 162.243.188.66.41515: Flags [P.], seq 113792:114176, ack 1, win 501, options [nop,nop,TS val 1197097072 ecr 2072457900], length 384
00:20:56.369508 IP 162.243.188.66.41515 > 178.128.225.34.22: Flags [.], ack 114176, win 898, options [nop,nop,TS val 2072458001 ecr 1197097072], length 0
00:20:56.455286 IP 178.128.225.34.22 > 162.243.188.66.41515: Flags [P.], seq 114176:114560, ack 1, win 501, options [nop,nop,TS val 1197097176 ecr 2072458001], length 384
00:20:56.471866 IP 162.243.188.66.41515 > 178.128.225.34.22: Flags [.], ack 114560, win 898, options [nop,nop,TS val 2072458104 ecr 1197097176], length 0
00:20:56.559409 IP 178.128.225.34.22 > 162.243.188.66.41515: Flags [P.], seq 114560:114944, ack 1, win 501, options [nop,nop,TS val 1197097280 ecr 2072458104], length 384
00:20:56.575958 IP 162.243.188.66.41515 > 178.128.225.34.22: Flags [.], ack 114944, win 898, options [nop,nop,TS val 2072458208 ecr 1197097280], length 0
00:20:56.663267 IP 178.128.225.34.22 > 162.243.188.66.41515: Flags [P.], seq 114944:115328, ack 1, win 501, options [nop,nop,TS val 1197097384 ecr 2072458208], length 384
00:20:56.686045 IP 162.243.188.66.41515 > 178.128.225.34.22: Flags [.], ack 115328, win 898, options [nop,nop,TS val 2072458318 ecr 1197097384], length 0
00:20:56.767330 IP 178.128.225.34.22 > 162.243.188.66.41515: Flags [P.], seq 115328:115712, ack 1, win 501, options [nop,nop,TS val 1197097488 ecr 2072458318], length 384
00:20:56.784502 IP 162.243.188.66.41515 > 178.128.225.34.22: Flags [.], ack 115712, win 898, options [nop,nop,TS val 2072458416 ecr 1197097488], length 0
00:20:56.871261 IP 178.128.225.34.22 > 162.243.188.66.41515: Flags [P.], seq 115712:116096, ack 1, win 501, options [nop,nop,TS val 1197097592 ecr 2072458416], length 384
00:20:56.887263 IP 162.243.188.66.41515 > 178.128.225.34.22: Flags [.], ack 116096, win 898, options [nop,nop,TS val 2072458519 ecr 1197097592], length 0
00:20:56.975272 IP 178.128.225.34.22 > 162.243.188.66.41515: Flags [P.], seq 116096:116480, ack 1, win 501, options [nop,nop,TS val 1197097696 ecr 2072458519], length 384
00:20:56.994470 IP 162.243.188.66.41515 > 178.128.225.34.22: Flags [.], ack 116480, win 898, options [nop,nop,TS val 2072458626 ecr 1197097696], length 0
00:20:57.011370 IP 218.92.0.102.33655 > 178.128.225.34.22: Flags [S], seq 2278726906, win 29200, options [mss 1460,sackOK,TS val 18495555 ecr 0,nop,wscale 7], length 0
00:20:57.011419 IP 178.128.225.34.22 > 218.92.0.102.33655: Flags [S.], seq 3611222848, ack 2278726907, win 65160, options [mss 1460,sackOK,TS val 2236156178 ecr 18494804,nop,wscale 7], length 0
00:20:57.079377 IP 178.128.225.34.22 > 162.243.188.66.41515: Flags [P.], seq 116480:117232, ack 1, win 501, options [nop,nop,TS val 1197097800 ecr 2072458626], length 752
00:20:57.100914 IP 162.243.188.66.41515 > 178.128.225.34.22: Flags [.], ack 117232, win 898, options [nop,nop,TS val 2072458733 ecr 1197097800], length 0
00:20:57.183272 IP 178.128.225.34.22 > 162.243.188.66.41515: Flags [P.], seq 117232:117616, ack 1, win 501, options [nop,nop,TS val 1197097904 ecr 2072458733], length 384
00:20:57.201966 IP 162.243.188.66.41515 > 178.128.225.34.22: Flags [.], ack 117616, win 898, options [nop,nop,TS val 2072458834 ecr 1197097904], length 0
00:20:57.287435 IP 178.128.225.34.22 > 162.243.188.66.41515: Flags [P.], seq 117616:118000, ack 1, win 501, options [nop,nop,TS val 1197098008 ecr 2072458834], length 384
00:20:57.307252 IP 162.243.188.66.41515 > 178.128.225.34.22: Flags [.], ack 118000, win 898, options [nop,nop,TS val 2072458939 ecr 1197098008], length 0
00:20:57.391296 IP 178.128.225.34.22 > 162.243.188.66.41515: Flags [P.], seq 118000:118384, ack 1, win 501, options [nop,nop,TS val 1197098112 ecr 2072458939], length 384
00:20:57.411324 IP 162.243.188.66.41515 > 178.128.225.34.22: Flags [.], ack 118384, win 898, options [nop,nop,TS val 2072459043 ecr 1197098112], length 0
00:20:57.495270 IP 178.128.225.34.22 > 162.243.188.66.41515: Flags [P.], seq 118384:118768, ack 1, win 501, options [nop,nop,TS val 1197098216 ecr 2072459043], length 384
00:20:57.514774 IP 162.243.188.66.41515 > 178.128.225.34.22: Flags [.], ack 118768, win 898, options [nop,nop,TS val 2072459147 ecr 1197098216], length 0
00:20:57.599273 IP 178.128.225.34.22 > 162.243.188.66.41515: Flags [P.], seq 118768:119152, ack 1, win 501, options [nop,nop,TS val 1197098320 ecr 2072459147], length 384
00:20:57.622648 IP 162.243.188.66.41515 > 178.128.225.34.22: Flags [.], ack 119152, win 898, options [nop,nop,TS val 2072459255 ecr 1197098320], length 0
00:20:57.703301 IP 178.128.225.34.22 > 162.243.188.66.41515: Flags [P.], seq 119152:119536, ack 1, win 501, options [nop,nop,TS val 1197098424 ecr 2072459255], length 384
00:20:57.719741 IP 162.243.188.66.41515 > 178.128.225.34.22: Flags [.], ack 119536, win 898, options [nop,nop,TS val 2072459352 ecr 1197098424], length 0
^C
570 packets captured
576 packets received by filter
0 packets dropped by kernel