root@comp3134-lamponubuntu2204-s-2vcpu-4gb-tor1-01:~# tcpdump -r 0001.pcap
reading from file 0001.pcap, link-type EN10MB (Ethernet), snapshot length 262144
00:19:09.736239 IP comp3134-lamponubuntu2204-s-2vcpu-4gb-tor1-01.ssh > 162.243.188.66.41515: Flags [P.], seq 2084223597:2084223661, ack 4122723675, win 501, options [nop,nop,TS val 1196990457 ecr 2072351357], length 64
00:19:09.736310 IP comp3134-lamponubuntu2204-s-2vcpu-4gb-tor1-01.ssh > 162.243.188.66.41515: Flags [P.], seq 64:144, ack 1, win 501, options [nop,nop,TS val 1196990457 ecr 2072351357], length 80
00:19:09.736398 IP comp3134-lamponubuntu2204-s-2vcpu-4gb-tor1-01.ssh > 162.243.188.66.41515: Flags [P.], seq 144:304, ack 1, win 501, options [nop,nop,TS val 1196990457 ecr 2072351357], length 160
00:19:09.736458 IP comp3134-lamponubuntu2204-s-2vcpu-4gb-tor1-01.ssh > 162.243.188.66.41515: Flags [P.], seq 304:368, ack 1, win 501, options [nop,nop,TS val 1196990457 ecr 2072351357], length 64
00:19:09.741503 IP 162.243.188.66.41515 > comp3134-lamponubuntu2204-s-2vcpu-4gb-tor1-01.ssh: Flags [.], ack 0, win 898, options [nop,nop,TS val 2072351373 ecr 1196990448], length 0
00:19:09.750582 IP 162.243.188.66.41515 > comp3134-lamponubuntu2204-s-2vcpu-4gb-tor1-01.ssh: Flags [.], ack 64, win 898, options [nop,nop,TS val 2072351382 ecr 1196990457], length 0
00:19:09.750582 IP 162.243.188.66.41515 > comp3134-lamponubuntu2204-s-2vcpu-4gb-tor1-01.ssh: Flags [.], ack 144, win 898, options [nop,nop,TS val 2072351383 ecr 1196990457], length 0
00:19:09.750582 IP 162.243.188.66.41515 > comp3134-lamponubuntu2204-s-2vcpu-4gb-tor1-01.ssh: Flags [.], ack 304, win 898, options [nop,nop,TS val 2072351383 ecr 1196990457], length 0
00:19:09.750653 IP 162.243.188.66.41515 > comp3134-lamponubuntu2204-s-2vcpu-4gb-tor1-01.ssh: Flags [.], ack 368, win 898, options [nop,nop,TS val 2072351383 ecr 1196990457], length 0
00:19:17.318137 IP ip-114-2.4vendeta.com.40672 > comp3134-lamponubuntu2204-s-2vcpu-4gb-tor1-01.3108: Flags [S], seq 518731876, win 1025, options [mss 1460], length 0
00:19:22.906914 IP 218.92.0.102.29672 > comp3134-lamponubuntu2204-s-2vcpu-4gb-tor1-01.ssh: Flags [S], seq 3336944078, win 29200, options [mss 1460,sackOK,TS val 18472027 ecr 0,nop,wscale 7], length 0
00:19:22.906985 IP comp3134-lamponubuntu2204-s-2vcpu-4gb-tor1-01.ssh > 218.92.0.102.29672: Flags [S.], seq 417194721, ack 3336944079, win 65160, options [mss 1460,sackOK,TS val 2236062073 ecr 18472027,nop,wscale 7], length 0
00:19:23.906466 IP 218.92.0.102.29672 > comp3134-lamponubuntu2204-s-2vcpu-4gb-tor1-01.ssh: Flags [S], seq 3336944078, win 29200, options [mss 1460,sackOK,TS val 18472277 ecr 0,nop,wscale 7], length 0
00:19:23.906518 IP comp3134-lamponubuntu2204-s-2vcpu-4gb-tor1-01.ssh > 218.92.0.102.29672: Flags [S.], seq 417194721, ack 3336944079, win 65160, options [mss 1460,sackOK,TS val 2236063073 ecr 18472027,nop,wscale 7], length 0
00:19:24.907057 IP comp3134-lamponubuntu2204-s-2vcpu-4gb-tor1-01.ssh > 218.92.0.102.29672: Flags [S.], seq 417194721, ack 3336944079, win 65160, options [mss 1460,sackOK,TS val 2236064074 ecr 18472027,nop,wscale 7], length 0
00:19:24.916709 IP 162.243.188.66.41515 > comp3134-lamponubuntu2204-s-2vcpu-4gb-tor1-01.ssh: Flags [.], ack 368, win 898, options [nop,nop,TS val 2072366548 ecr 1196990457], length 0
00:19:24.916756 IP comp3134-lamponubuntu2204-s-2vcpu-4gb-tor1-01.ssh > 162.243.188.66.41515: Flags [.], ack 1, win 501, options [nop,nop,TS val 1197005637 ecr 2072351383], length 0
00:19:25.910605 IP 218.92.0.102.29672 > comp3134-lamponubuntu2204-s-2vcpu-4gb-tor1-01.ssh: Flags [S], seq 3336944078, win 29200, options [mss 1460,sackOK,TS val 18472778 ecr 0,nop,wscale 7], length 0
00:19:25.910659 IP comp3134-lamponubuntu2204-s-2vcpu-4gb-tor1-01.ssh > 218.92.0.102.29672: Flags [S.], seq 417194721, ack 3336944079, win 65160, options [mss 1460,sackOK,TS val 2236065077 ecr 18472027,nop,wscale 7], length 0
00:19:27.900147 IP 218.92.0.102.13907 > comp3134-lamponubuntu2204-s-2vcpu-4gb-tor1-01.ssh: Flags [S], seq 2339239984, win 29200, options [mss 1460,sackOK,TS val 18473278 ecr 0,nop,wscale 7], length 0
00:19:27.900249 IP comp3134-lamponubuntu2204-s-2vcpu-4gb-tor1-01.ssh > 218.92.0.102.13907: Flags [S.], seq 830389086, ack 2339239985, win 65160, options [mss 1460,sackOK,TS val 2236067067 ecr 18473278,nop,wscale 7], length 0
00:19:27.915056 IP comp3134-lamponubuntu2204-s-2vcpu-4gb-tor1-01.ssh > 218.92.0.102.29672: Flags [S.], seq 417194721, ack 3336944079, win 65160, options [mss 1460,sackOK,TS val 2236067082 ecr 18472027,nop,wscale 7], length 0
00:19:28.900043 IP 218.92.0.102.13907 > comp3134-lamponubuntu2204-s-2vcpu-4gb-tor1-01.ssh: Flags [S], seq 2339239984, win 29200, options [mss 1460,sackOK,TS val 18473528 ecr 0,nop,wscale 7], length 0
00:19:28.900091 IP comp3134-lamponubuntu2204-s-2vcpu-4gb-tor1-01.ssh > 218.92.0.102.13907: Flags [S.], seq 830389086, ack 2339239985, win 65160, options [mss 1460,sackOK,TS val 2236068067 ecr 18473278,nop,wscale 7], length 0
00:19:29.931059 IP comp3134-lamponubuntu2204-s-2vcpu-4gb-tor1-01.ssh > 218.92.0.102.13907: Flags [S.], seq 830389086, ack 2339239985, win 65160, options [mss 1460,sackOK,TS val 2236069098 ecr 18473278,nop,wscale 7], length 0
00:19:30.904030 IP 218.92.0.102.13907 > comp3134-lamponubuntu2204-s-2vcpu-4gb-tor1-01.ssh: Flags [S], seq 2339239984, win 29200, options [mss 1460,sackOK,TS val 18474029 ecr 0,nop,wscale 7], length 0
00:19:30.904097 IP comp3134-lamponubuntu2204-s-2vcpu-4gb-tor1-01.ssh > 218.92.0.102.13907: Flags [S.], seq 830389086, ack 2339239985, win 65160, options [mss 1460,sackOK,TS val 2236070071 ecr 18473278,nop,wscale 7], length 0
00:19:32.171060 IP comp3134-lamponubuntu2204-s-2vcpu-4gb-tor1-01.ssh > 218.92.0.102.29672: Flags [S.], seq 417194721, ack 3336944079, win 65160, options [mss 1460,sackOK,TS val 2236071338 ecr 18472027,nop,wscale 7], length 0
00:19:32.907057 IP comp3134-lamponubuntu2204-s-2vcpu-4gb-tor1-01.ssh > 218.92.0.102.13907: Flags [S.], seq 830389086, ack 2339239985, win 65160, options [mss 1460,sackOK,TS val 2236072074 ecr 18473278,nop,wscale 7], length 0
00:19:32.912751 IP 218.92.0.102.53193 > comp3134-lamponubuntu2204-s-2vcpu-4gb-tor1-01.ssh: Flags [S], seq 1954287057, win 29200, options [mss 1460,sackOK,TS val 18474529 ecr 0,nop,wscale 7], length 0
00:19:32.912819 IP comp3134-lamponubuntu2204-s-2vcpu-4gb-tor1-01.ssh > 218.92.0.102.53193: Flags [S.], seq 720396547, ack 1954287058, win 65160, options [mss 1460,sackOK,TS val 2236072079 ecr 18474529,nop,wscale 7], length 0
00:19:33.912691 IP 218.92.0.102.53193 > comp3134-lamponubuntu2204-s-2vcpu-4gb-tor1-01.ssh: Flags [S], seq 1954287057, win 29200, options [mss 1460,sackOK,TS val 18474779 ecr 0,nop,wscale 7], length 0
00:19:33.912754 IP comp3134-lamponubuntu2204-s-2vcpu-4gb-tor1-01.ssh > 218.92.0.102.53193: Flags [S.], seq 720396547, ack 1954287058, win 65160, options [mss 1460,sackOK,TS val 2236073079 ecr 18474529,nop,wscale 7], length 0
00:19:34.923078 IP comp3134-lamponubuntu2204-s-2vcpu-4gb-tor1-01.ssh > 218.92.0.102.53193: Flags [S.], seq 720396547, ack 1954287058, win 65160, options [mss 1460,sackOK,TS val 2236074090 ecr 18474529,nop,wscale 7], length 0
00:19:35.916510 IP 218.92.0.102.53193 > comp3134-lamponubuntu2204-s-2vcpu-4gb-tor1-01.ssh: Flags [S], seq 1954287057, win 29200, options [mss 1460,sackOK,TS val 18475280 ecr 0,nop,wscale 7], length 0
00:19:35.916570 IP comp3134-lamponubuntu2204-s-2vcpu-4gb-tor1-01.ssh > 218.92.0.102.53193: Flags [S.], seq 720396547, ack 1954287058, win 65160, options [mss 1460,sackOK,TS val 2236075083 ecr 18474529,nop,wscale 7], length 0
00:19:37.035036 IP comp3134-lamponubuntu2204-s-2vcpu-4gb-tor1-01.ssh > 218.92.0.102.13907: Flags [S.], seq 830389086, ack 2339239985, win 65160, options [mss 1460,sackOK,TS val 2236076202 ecr 18473278,nop,wscale 7], length 0