00:10:51.279253 IP comp3134-lamponubuntu2204-s-2vcpu-4gb-tor1-01.ssh > 162.243.188.66.41515: Flags [P.], seq 108688:109136, ack 1, win 501, options [nop,nop,TS val 1196492000 ecr 2071852825], length 448
00:10:51.302189 IP 162.243.188.66.41515 > comp3134-lamponubuntu2204-s-2vcpu-4gb-tor1-01.ssh: Flags [.], ack 109136, win 889, options [nop,nop,TS val 2071852934 ecr 1196492000], length 0
00:10:51.383265 IP comp3134-lamponubuntu2204-s-2vcpu-4gb-tor1-01.ssh > 162.243.188.66.41515: Flags [P.], seq 109136:109584, ack 1, win 501, options [nop,nop,TS val 1196492104 ecr 2071852934], length 448
00:10:51.405080 IP 162.243.188.66.41515 > comp3134-lamponubuntu2204-s-2vcpu-4gb-tor1-01.ssh: Flags [.], ack 109584, win 889, options [nop,nop,TS val 2071853034 ecr 1196492104], length 0
00:10:51.487251 IP comp3134-lamponubuntu2204-s-2vcpu-4gb-tor1-01.ssh > 162.243.188.66.41515: Flags [P.], seq 109584:110032, ack 1, win 501, options [nop,nop,TS val 1196492208 ecr 2071853034], length 448
00:10:51.506550 IP 162.243.188.66.41515 > comp3134-lamponubuntu2204-s-2vcpu-4gb-tor1-01.ssh: Flags [.], ack 110032, win 889, options [nop,nop,TS val 2071853136 ecr 1196492208], length 0
00:10:51.591255 IP comp3134-lamponubuntu2204-s-2vcpu-4gb-tor1-01.ssh > 162.243.188.66.41515: Flags [P.], seq 110032:110480, ack 1, win 501, options [nop,nop,TS val 1196492312 ecr 2071853136], length 448
00:10:51.615638 IP 162.243.188.66.41515 > comp3134-lamponubuntu2204-s-2vcpu-4gb-tor1-01.ssh: Flags [.], ack 110480, win 889, options [nop,nop,TS val 2071853248 ecr 1196492312], length 0
00:10:51.695280 IP comp3134-lamponubuntu2204-s-2vcpu-4gb-tor1-01.ssh > 162.243.188.66.41515: Flags [P.], seq 110480:110928, ack 1, win 501, options [nop,nop,TS val 1196492416 ecr 2071853248], length 448
00:10:51.715903 IP 162.243.188.66.41515 > comp3134-lamponubuntu2204-s-2vcpu-4gb-tor1-01.ssh: Flags [.], ack 110928, win 889, options [nop,nop,TS val 2071853348 ecr 1196492416], length 0
00:10:51.799264 IP comp3134-lamponubuntu2204-s-2vcpu-4gb-tor1-01.ssh > 162.243.188.66.41515: Flags [P.], seq 110928:111376, ack 1, win 501, options [nop,nop,TS val 1196492520 ecr 2071853348], length 448
00:10:51.821898 IP 162.243.188.66.41515 > comp3134-lamponubuntu2204-s-2vcpu-4gb-tor1-01.ssh: Flags [.], ack 111376, win 889, options [nop,nop,TS val 2071853448 ecr 1196492520], length 0
00:10:51.903290 IP comp3134-lamponubuntu2204-s-2vcpu-4gb-tor1-01.ssh > 162.243.188.66.41515: Flags [P.], seq 111376:111824, ack 1, win 501, options [nop,nop,TS val 1196492624 ecr 2071853448], length 448
00:10:51.929073 IP 162.243.188.66.41515 > comp3134-lamponubuntu2204-s-2vcpu-4gb-tor1-01.ssh: Flags [.], ack 111824, win 889, options [nop,nop,TS val 2071853552 ecr 1196492624], length 0
00:10:52.007458 IP comp3134-lamponubuntu2204-s-2vcpu-4gb-tor1-01.ssh > 162.243.188.66.41515: Flags [P.], seq 111824:112272, ack 1, win 501, options [nop,nop,TS val 1196492728 ecr 2071853552], length 448
00:10:52.034626 IP 162.243.188.66.41515 > comp3134-lamponubuntu2204-s-2vcpu-4gb-tor1-01.ssh: Flags [.], ack 112272, win 889, options [nop,nop,TS val 2071853661 ecr 1196492728], length 0
00:10:52.111294 IP comp3134-lamponubuntu2204-s-2vcpu-4gb-tor1-01.ssh > 162.243.188.66.41515: Flags [P.], seq 112272:112720, ack 1, win 501, options [nop,nop,TS val 1196492832 ecr 2071853661], length 448
00:10:52.130579 IP 162.243.188.66.41515 > comp3134-lamponubuntu2204-s-2vcpu-4gb-tor1-01.ssh: Flags [.], ack 112720, win 889, options [nop,nop,TS val 2071853760 ecr 1196492832], length 0
00:10:52.215432 IP comp3134-lamponubuntu2204-s-2vcpu-4gb-tor1-01.ssh > 162.243.188.66.41515: Flags [P.], seq 112720:113168, ack 1, win 501, options [nop,nop,TS val 1196492936 ecr 2071853760], length 448
00:10:52.234490 IP 162.243.188.66.41515 > comp3134-lamponubuntu2204-s-2vcpu-4gb-tor1-01.ssh: Flags [.], ack 113168, win 889, options [nop,nop,TS val 2071853866 ecr 1196492936], length 0
00:10:52.319265 IP comp3134-lamponubuntu2204-s-2vcpu-4gb-tor1-01.ssh > 162.243.188.66.41515: Flags [P.], seq 113168:113616, ack 1, win 501, options [nop,nop,TS val 1196493040 ecr 2071853866], length 448
00:10:52.336554 IP 162.243.188.66.41515 > comp3134-lamponubuntu2204-s-2vcpu-4gb-tor1-01.ssh: Flags [.], ack 113616, win 889, options [nop,nop,TS val 2071853968 ecr 1196493040], length 0
00:10:52.423287 IP comp3134-lamponubuntu2204-s-2vcpu-4gb-tor1-01.ssh > 162.243.188.66.41515: Flags [P.], seq 113616:114064, ack 1, win 501, options [nop,nop,TS val 1196493144 ecr 2071853968], length 448
00:10:52.446690 IP 162.243.188.66.41515 > comp3134-lamponubuntu2204-s-2vcpu-4gb-tor1-01.ssh: Flags [.], ack 114064, win 889, options [nop,nop,TS val 2071854076 ecr 1196493144], length 0
00:10:52.527283 IP comp3134-lamponubuntu2204-s-2vcpu-4gb-tor1-01.ssh > 162.243.188.66.41515: Flags [P.], seq 114064:114512, ack 1, win 501, options [nop,nop,TS val 1196493248 ecr 2071854076], length 448
00:10:52.545609 IP 162.243.188.66.41515 > comp3134-lamponubuntu2204-s-2vcpu-4gb-tor1-01.ssh: Flags [.], ack 114512, win 889, options [nop,nop,TS val 2071854178 ecr 1196493248], length 0
00:10:52.631443 IP comp3134-lamponubuntu2204-s-2vcpu-4gb-tor1-01.ssh > 162.243.188.66.41515: Flags [P.], seq 114512:114960, ack 1, win 501, options [nop,nop,TS val 1196493352 ecr 2071854178], length 448
00:10:52.649274 IP 162.243.188.66.41515 > comp3134-lamponubuntu2204-s-2vcpu-4gb-tor1-01.ssh: Flags [.], ack 114960, win 889, options [nop,nop,TS val 2071854280 ecr 1196493352], length 0
00:10:52.735204 IP comp3134-lamponubuntu2204-s-2vcpu-4gb-tor1-01.ssh > 162.243.188.66.41515: Flags [P.], seq 114960:115408, ack 1, win 501, options [nop,nop,TS val 1196493456 ecr 2071854280], length 448
00:10:52.776007 IP 162.243.188.66.41515 > comp3134-lamponubuntu2204-s-2vcpu-4gb-tor1-01.ssh: Flags [.], ack 115408, win 889, options [nop,nop,TS val 2071854406 ecr 1196493456], length 0
00:10:52.839245 IP comp3134-lamponubuntu2204-s-2vcpu-4gb-tor1-01.ssh > 162.243.188.66.41515: Flags [P.], seq 115408:115856, ack 1, win 501, options [nop,nop,TS val 1196493560 ecr 2071854406], length 448
00:10:52.871109 IP 162.243.188.66.41515 > comp3134-lamponubuntu2204-s-2vcpu-4gb-tor1-01.ssh: Flags [.], ack 115856, win 889, options [nop,nop,TS val 2071854497 ecr 1196493560], length 0
00:10:52.943251 IP comp3134-lamponubuntu2204-s-2vcpu-4gb-tor1-01.ssh > 162.243.188.66.41515: Flags [P.], seq 115856:116304, ack 1, win 501, options [nop,nop,TS val 1196493664 ecr 2071854497], length 448
00:10:52.965646 IP 162.243.188.66.41515 > comp3134-lamponubuntu2204-s-2vcpu-4gb-tor1-01.ssh: Flags [.], ack 116304, win 889, options [nop,nop,TS val 2071854596 ecr 1196493664], length 0
00:10:53.047285 IP comp3134-lamponubuntu2204-s-2vcpu-4gb-tor1-01.ssh > 162.243.188.66.41515: Flags [P.], seq 116304:116752, ack 1, win 501, options [nop,nop,TS val 1196493768 ecr 2071854596], length 448
00:10:53.066517 IP 162.243.188.66.41515 > comp3134-lamponubuntu2204-s-2vcpu-4gb-tor1-01.ssh: Flags [.], ack 116752, win 889, options [nop,nop,TS val 2071854696 ecr 1196493768], length 0
00:10:53.151338 IP comp3134-lamponubuntu2204-s-2vcpu-4gb-tor1-01.ssh > 162.243.188.66.41515: Flags [P.], seq 116752:117200, ack 1, win 501, options [nop,nop,TS val 1196493872 ecr 2071854696], length 448
00:10:53.168607 IP 162.243.188.66.41515 > comp3134-lamponubuntu2204-s-2vcpu-4gb-tor1-01.ssh: Flags [.], ack 117200, win 889, options [nop,nop,TS val 2071854800 ecr 1196493872], length 0
00:10:53.255287 IP comp3134-lamponubuntu2204-s-2vcpu-4gb-tor1-01.ssh > 162.243.188.66.41515: Flags [P.], seq 117200:117648, ack 1, win 501, options [nop,nop,TS val 1196493976 ecr 2071854800], length 448
00:10:53.271813 IP 162.243.188.66.41515 > comp3134-lamponubuntu2204-s-2vcpu-4gb-tor1-01.ssh: Flags [.], ack 117648, win 889, options [nop,nop,TS val 2071854904 ecr 1196493976], length 0
00:10:53.359218 IP comp3134-lamponubuntu2204-s-2vcpu-4gb-tor1-01.ssh > 162.243.188.66.41515: Flags [P.], seq 117648:118096, ack 1, win 501, options [nop,nop,TS val 1196494080 ecr 2071854904], length 448
00:10:53.380754 IP 162.243.188.66.41515 > comp3134-lamponubuntu2204-s-2vcpu-4gb-tor1-01.ssh: Flags [.], ack 118096, win 889, options [nop,nop,TS val 2071855013 ecr 1196494080], length 0
00:10:53.463434 IP comp3134-lamponubuntu2204-s-2vcpu-4gb-tor1-01.ssh > 162.243.188.66.41515: Flags [P.], seq 118096:118544, ack 1, win 501, options [nop,nop,TS val 1196494184 ecr 2071855013], length 448
00:10:53.483201 IP 162.243.188.66.41515 > comp3134-lamponubuntu2204-s-2vcpu-4gb-tor1-01.ssh: Flags [.], ack 118544, win 889, options [nop,nop,TS val 2071855115 ecr 1196494184], length 0
00:10:53.567290 IP comp3134-lamponubuntu2204-s-2vcpu-4gb-tor1-01.ssh > 162.243.188.66.41515: Flags [P.], seq 118544:118992, ack 1, win 501, options [nop,nop,TS val 1196494288 ecr 2071855115], length 448
00:10:53.585025 IP 162.243.188.66.41515 > comp3134-lamponubuntu2204-s-2vcpu-4gb-tor1-01.ssh: Flags [.], ack 118992, win 889, options [nop,nop,TS val 2071855217 ecr 1196494288], length 0
00:10:53.671272 IP comp3134-lamponubuntu2204-s-2vcpu-4gb-tor1-01.ssh > 162.243.188.66.41515: Flags [P.], seq 118992:119440, ack 1, win 501, options [nop,nop,TS val 1196494392 ecr 2071855217], length 448
00:10:53.690801 IP 162.243.188.66.41515 > comp3134-lamponubuntu2204-s-2vcpu-4gb-tor1-01.ssh: Flags [.], ack 119440, win 889, options [nop,nop,TS val 2071855323 ecr 1196494392], length 0
00:10:53.775252 IP comp3134-lamponubuntu2204-s-2vcpu-4gb-tor1-01.ssh > 162.243.188.66.41515: Flags [P.], seq 119440:119888, ack 1, win 501, options [nop,nop,TS val 1196494496 ecr 2071855323], length 448
00:10:53.792311 IP 162.243.188.66.41515 > comp3134-lamponubuntu2204-s-2vcpu-4gb-tor1-01.ssh: Flags [.], ack 119888, win 889, options [nop,nop,TS val 2071855424 ecr 1196494496], length 0
00:10:53.879326 IP comp3134-lamponubuntu2204-s-2vcpu-4gb-tor1-01.ssh > 162.243.188.66.41515: Flags [P.], seq 119888:120336, ack 1, win 501, options [nop,nop,TS val 1196494600 ecr 2071855424], length 448
00:10:53.897765 IP 162.243.188.66.41515 > comp3134-lamponubuntu2204-s-2vcpu-4gb-tor1-01.ssh: Flags [.], ack 120336, win 889, options [nop,nop,TS val 2071855530 ecr 1196494600], length 0
00:10:53.983241 IP comp3134-lamponubuntu2204-s-2vcpu-4gb-tor1-01.ssh > 162.243.188.66.41515: Flags [P.], seq 120336:120784, ack 1, win 501, options [nop,nop,TS val 1196494704 ecr 2071855530], length 448
00:10:54.000604 IP 162.243.188.66.41515 > comp3134-lamponubuntu2204-s-2vcpu-4gb-tor1-01.ssh: Flags [.], ack 120784, win 889, options [nop,nop,TS val 2071855633 ecr 1196494704], length 0
00:10:54.087257 IP comp3134-lamponubuntu2204-s-2vcpu-4gb-tor1-01.ssh > 162.243.188.66.41515: Flags [P.], seq 120784:121232, ack 1, win 501, options [nop,nop,TS val 1196494808 ecr 2071855633], length 448
00:10:54.111224 IP 162.243.188.66.41515 > comp3134-lamponubuntu2204-s-2vcpu-4gb-tor1-01.ssh: Flags [.], ack 121232, win 889, options [nop,nop,TS val 2071855743 ecr 1196494808], length 0
00:10:54.191370 IP comp3134-lamponubuntu2204-s-2vcpu-4gb-tor1-01.ssh > 162.243.188.66.41515: Flags [P.], seq 121232:121680, ack 1, win 501, options [nop,nop,TS val 1196494912 ecr 2071855743], length 448
00:10:54.221645 IP 162.243.188.66.41515 > comp3134-lamponubuntu2204-s-2vcpu-4gb-tor1-01.ssh: Flags [.], ack 121680, win 889, options [nop,nop,TS val 2071855854 ecr 1196494912], length 0
00:10:54.295222 IP comp3134-lamponubuntu2204-s-2vcpu-4gb-tor1-01.ssh > 162.243.188.66.41515: Flags [P.], seq 121680:122128, ack 1, win 501, options [nop,nop,TS val 1196495016 ecr 2071855854], length 448
00:10:54.315841 IP 162.243.188.66.41515 > comp3134-lamponubuntu2204-s-2vcpu-4gb-tor1-01.ssh: Flags [.], ack 122128, win 889, options [nop,nop,TS val 2071855948 ecr 1196495016], length 0
00:10:54.399241 IP comp3134-lamponubuntu2204-s-2vcpu-4gb-tor1-01.ssh > 162.243.188.66.41515: Flags [P.], seq 122128:122576, ack 1, win 501, options [nop,nop,TS val 1196495120 ecr 2071855948], length 448
00:10:54.421098 IP 162.243.188.66.41515 > comp3134-lamponubuntu2204-s-2vcpu-4gb-tor1-01.ssh: Flags [.], ack 122576, win 889, options [nop,nop,TS val 2071856053 ecr 1196495120], length 0
00:10:54.503282 IP comp3134-lamponubuntu2204-s-2vcpu-4gb-tor1-01.ssh > 162.243.188.66.41515: Flags [P.], seq 122576:123024, ack 1, win 501, options [nop,nop,TS val 1196495224 ecr 2071856053], length 448
00:10:54.525688 IP 162.243.188.66.41515 > comp3134-lamponubuntu2204-s-2vcpu-4gb-tor1-01.ssh: Flags [.], ack 123024, win 889, options [nop,nop,TS val 2071856158 ecr 1196495224], length 0
00:10:54.607250 IP comp3134-lamponubuntu2204-s-2vcpu-4gb-tor1-01.ssh > 162.243.188.66.41515: Flags [P.], seq 123024:123472, ack 1, win 501, options [nop,nop,TS val 1196495328 ecr 2071856158], length 448
00:10:54.626704 IP 162.243.188.66.41515 > comp3134-lamponubuntu2204-s-2vcpu-4gb-tor1-01.ssh: Flags [.], ack 123472, win 889, options [nop,nop,TS val 2071856259 ecr 1196495328], length 0
00:10:54.711328 IP comp3134-lamponubuntu2204-s-2vcpu-4gb-tor1-01.ssh > 162.243.188.66.41515: Flags [P.], seq 123472:123920, ack 1, win 501, options [nop,nop,TS val 1196495432 ecr 2071856259], length 448
00:10:54.727874 IP 162.243.188.66.41515 > comp3134-lamponubuntu2204-s-2vcpu-4gb-tor1-01.ssh: Flags [.], ack 123920, win 889, options [nop,nop,TS val 2071856360 ecr 1196495432], length 0
00:10:54.815284 IP comp3134-lamponubuntu2204-s-2vcpu-4gb-tor1-01.ssh > 162.243.188.66.41515: Flags [P.], seq 123920:124368, ack 1, win 501, options [nop,nop,TS val 1196495536 ecr 2071856360], length 448
00:10:54.832997 IP 162.243.188.66.41515 > comp3134-lamponubuntu2204-s-2vcpu-4gb-tor1-01.ssh: Flags [.], ack 124368, win 889, options [nop,nop,TS val 2071856465 ecr 1196495536], length 0
00:10:54.919255 IP comp3134-lamponubuntu2204-s-2vcpu-4gb-tor1-01.ssh > 162.243.188.66.41515: Flags [P.], seq 124368:124816, ack 1, win 501, options [nop,nop,TS val 1196495640 ecr 2071856465], length 448
00:10:54.936124 IP 162.243.188.66.41515 > comp3134-lamponubuntu2204-s-2vcpu-4gb-tor1-01.ssh: Flags [.], ack 124816, win 889, options [nop,nop,TS val 2071856568 ecr 1196495640], length 0
00:10:55.023292 IP comp3134-lamponubuntu2204-s-2vcpu-4gb-tor1-01.ssh > 162.243.188.66.41515: Flags [P.], seq 124816:125264, ack 1, win 501, options [nop,nop,TS val 1196495744 ecr 2071856568], length 448
00:10:55.051986 IP 162.243.188.66.41515 > comp3134-lamponubuntu2204-s-2vcpu-4gb-tor1-01.ssh: Flags [.], ack 125264, win 889, options [nop,nop,TS val 2071856684 ecr 1196495744], length 0
00:10:55.127241 IP comp3134-lamponubuntu2204-s-2vcpu-4gb-tor1-01.ssh > 162.243.188.66.41515: Flags [P.], seq 125264:125712, ack 1, win 501, options [nop,nop,TS val 1196495848 ecr 2071856684], length 448
00:10:55.144080 IP 162.243.188.66.41515 > comp3134-lamponubuntu2204-s-2vcpu-4gb-tor1-01.ssh: Flags [.], ack 125712, win 889, options [nop,nop,TS val 2071856776 ecr 1196495848], length 0
00:10:55.231251 IP comp3134-lamponubuntu2204-s-2vcpu-4gb-tor1-01.ssh > 162.243.188.66.41515: Flags [P.], seq 125712:126160, ack 1, win 501, options [nop,nop,TS val 1196495952 ecr 2071856776], length 448
00:10:55.249787 IP 162.243.188.66.41515 > comp3134-lamponubuntu2204-s-2vcpu-4gb-tor1-01.ssh: Flags [.], ack 126160, win 889, options [nop,nop,TS val 2071856882 ecr 1196495952], length 0
00:10:55.335258 IP comp3134-lamponubuntu2204-s-2vcpu-4gb-tor1-01.ssh > 162.243.188.66.41515: Flags [P.], seq 126160:126608, ack 1, win 501, options [nop,nop,TS val 1196496056 ecr 2071856882], length 448
00:10:55.356967 IP 162.243.188.66.41515 > comp3134-lamponubuntu2204-s-2vcpu-4gb-tor1-01.ssh: Flags [.], ack 126608, win 889, options [nop,nop,TS val 2071856989 ecr 1196496056], length 0
00:10:55.439286 IP comp3134-lamponubuntu2204-s-2vcpu-4gb-tor1-01.ssh > 162.243.188.66.41515: Flags [P.], seq 126608:127056, ack 1, win 501, options [nop,nop,TS val 1196496160 ecr 2071856989], length 448
00:10:55.456463 IP 162.243.188.66.41515 > comp3134-lamponubuntu2204-s-2vcpu-4gb-tor1-01.ssh: Flags [.], ack 127056, win 889, options [nop,nop,TS val 2071857088 ecr 1196496160], length 0
00:10:55.543240 IP comp3134-lamponubuntu2204-s-2vcpu-4gb-tor1-01.ssh > 162.243.188.66.41515: Flags [P.], seq 127056:127504, ack 1, win 501, options [nop,nop,TS val 1196496264 ecr 2071857088], length 448
00:10:55.560216 IP 162.243.188.66.41515 > comp3134-lamponubuntu2204-s-2vcpu-4gb-tor1-01.ssh: Flags [.], ack 127504, win 889, options [nop,nop,TS val 2071857192 ecr 1196496264], length 0
00:10:55.647262 IP comp3134-lamponubuntu2204-s-2vcpu-4gb-tor1-01.ssh > 162.243.188.66.41515: Flags [P.], seq 127504:127952, ack 1, win 501, options [nop,nop,TS val 1196496368 ecr 2071857192], length 448
00:10:55.664845 IP 162.243.188.66.41515 > comp3134-lamponubuntu2204-s-2vcpu-4gb-tor1-01.ssh: Flags [.], ack 127952, win 889, options [nop,nop,TS val 2071857297 ecr 1196496368], length 0
00:10:55.751277 IP comp3134-lamponubuntu2204-s-2vcpu-4gb-tor1-01.ssh > 162.243.188.66.41515: Flags [P.], seq 127952:128400, ack 1, win 501, options [nop,nop,TS val 1196496472 ecr 2071857297], length 448
00:10:55.767762 IP 162.243.188.66.41515 > comp3134-lamponubuntu2204-s-2vcpu-4gb-tor1-01.ssh: Flags [.], ack 128400, win 889, options [nop,nop,TS val 2071857400 ecr 1196496472], length 0
00:10:55.855390 IP comp3134-lamponubuntu2204-s-2vcpu-4gb-tor1-01.ssh > 162.243.188.66.41515: Flags [P.], seq 128400:128848, ack 1, win 501, options [nop,nop,TS val 1196496576 ecr 2071857400], length 448
00:10:55.875268 IP 162.243.188.66.41515 > comp3134-lamponubuntu2204-s-2vcpu-4gb-tor1-01.ssh: Flags [.], ack 128848, win 889, options [nop,nop,TS val 2071857507 ecr 1196496576], length 0
00:10:55.959239 IP comp3134-lamponubuntu2204-s-2vcpu-4gb-tor1-01.ssh > 162.243.188.66.41515: Flags [P.], seq 128848:129296, ack 1, win 501, options [nop,nop,TS val 1196496680 ecr 2071857507], length 448
00:10:55.975738 IP 162.243.188.66.41515 > comp3134-lamponubuntu2204-s-2vcpu-4gb-tor1-01.ssh: Flags [.], ack 129296, win 889, options [nop,nop,TS val 2071857608 ecr 1196496680], length 0
00:10:56.063296 IP comp3134-lamponubuntu2204-s-2vcpu-4gb-tor1-01.ssh > 162.243.188.66.41515: Flags [P.], seq 129296:129744, ack 1, win 501, options [nop,nop,TS val 1196496784 ecr 2071857608], length 448
00:10:56.079974 IP 162.243.188.66.41515 > comp3134-lamponubuntu2204-s-2vcpu-4gb-tor1-01.ssh: Flags [.], ack 129744, win 889, options [nop,nop,TS val 2071857712 ecr 1196496784], length 0
^C
618 packets captured
626 packets received by filter
3 packets dropped by kernel
