root@comp3134-lamponubuntu2204-s-2vcpu-4gb-tor1-01:~# tcpdump -c 5 -i eth0
tcpdump: verbose output suppressed, use -v[v]... for full protocol decode
listening on eth0, link-type EN10MB (Ethernet), snapshot length 262144 bytes
00:15:14.078646 IP comp3134-lamponubuntu2204-s-2vcpu-4gb-tor1-01.ssh > 162.243.188.66.41515: Flags [P.], seq 2077357309:2077357437, ack 4122715483, win 501, options [nop,nop,TS val 1196754799 ecr 2072115703], length 128
00:15:14.078752 IP comp3134-lamponubuntu2204-s-2vcpu-4gb-tor1-01.ssh > 162.243.188.66.41515: Flags [P.], seq 128:272, ack 1, win 501, options [nop,nop,TS val 1196754799 ecr 2072115703], length 144
00:15:14.078866 IP comp3134-lamponubuntu2204-s-2vcpu-4gb-tor1-01.ssh > 162.243.188.66.41515: Flags [P.], seq 272:432, ack 1, win 501, options [nop,nop,TS val 1196754799 ecr 2072115703], length 160
00:15:14.079148 IP comp3134-lamponubuntu2204-s-2vcpu-4gb-tor1-01.ssh > 162.243.188.66.41515: Flags [P.], seq 432:496, ack 1, win 501, options [nop,nop,TS val 1196754800 ecr 2072115703], length 64
00:15:14.080488 IP 218.92.0.102.49734 > comp3134-lamponubuntu2204-s-2vcpu-4gb-tor1-01.ssh: Flags [S], seq 1842931381, win 29200, options [mss 1460,sackOK,TS val 18409820 ecr 0,nop,wscale 7], length 0
5 packets captured
51 packets received by filter
0 packets dropped by kernel