root@comp3134-lamponubuntu2204-s-2vcpu-4gb-tor1-01:~# tcpdump -r all_traffic_20240414_2030.pcap
reading from file all_traffic_20240414_2030.pcap, link-type EN10MB (Ethernet), snapshot length 262144
00:36:15.536059 IP comp3134-lamponubuntu2204-s-2vcpu-4gb-tor1-01.ssh > 162.243.188.66.41515: Flags [P.], seq 2084668733:2084668797, ack 4122746075, win 501, options [nop,nop,TS val 1198016257 ecr 2073377161], length 64
00:36:15.536916 IP comp3134-lamponubuntu2204-s-2vcpu-4gb-tor1-01.ssh > 162.243.188.66.41515: Flags [P.], seq 64:128, ack 1, win 501, options [nop,nop,TS val 1198016257 ecr 2073377161], length 64
00:36:15.536961 IP comp3134-lamponubuntu2204-s-2vcpu-4gb-tor1-01.ssh > 162.243.188.66.41515: Flags [P.], seq 128:208, ack 1, win 501, options [nop,nop,TS val 1198016257 ecr 2073377161], length 80
00:36:15.537129 IP comp3134-lamponubuntu2204-s-2vcpu-4gb-tor1-01.ssh > 162.243.188.66.41515: Flags [P.], seq 208:432, ack 1, win 501, options [nop,nop,TS val 1198016258 ecr 2073377161], length 224
00:36:15.550368 IP 162.243.188.66.41515 > comp3134-lamponubuntu2204-s-2vcpu-4gb-tor1-01.ssh: Flags [.], ack 64, win 898, options [nop,nop,TS val 2073377182 ecr 1198016257], length 0
00:36:15.551270 IP 162.243.188.66.41515 > comp3134-lamponubuntu2204-s-2vcpu-4gb-tor1-01.ssh: Flags [.], ack 128, win 898, options [nop,nop,TS val 2073377183 ecr 1198016257], length 0
00:36:15.551270 IP 162.243.188.66.41515 > comp3134-lamponubuntu2204-s-2vcpu-4gb-tor1-01.ssh: Flags [.], ack 208, win 898, options [nop,nop,TS val 2073377183 ecr 1198016257], length 0
00:36:15.551513 IP 162.243.188.66.41515 > comp3134-lamponubuntu2204-s-2vcpu-4gb-tor1-01.ssh: Flags [.], ack 432, win 898, options [nop,nop,TS val 2073377183 ecr 1198016258], length 0
00:36:15.947072 IP comp3134-lamponubuntu2204-s-2vcpu-4gb-tor1-01.ssh > 218.92.0.102.13873: Flags [S.], seq 3565338955, ack 3532213524, win 65160, options [mss 1460,sackOK,TS val 2237075114 ecr 18720931,nop,wscale 7], length 0
00:36:20.491989 IP 66.210.203.35.bc.googleusercontent.com.54891 > comp3134-lamponubuntu2204-s-2vcpu-4gb-tor1-01.9765: Flags [S], seq 1656395595, win 65535, options [mss 1460], length 0
00:36:20.811058 IP comp3134-lamponubuntu2204-s-2vcpu-4gb-tor1-01.ssh > 218.92.0.102.53273: Flags [S.], seq 993895559, ack 1700911519, win 65160, options [mss 1460,sackOK,TS val 2237079978 ecr 18722182,nop,wscale 7], length 0